Number;Name;Sponsor(s);Co-Sponsor(s);Steering Division;Project Facilitator;Status;SD Approval Date;TSC Approval Date;Type;Project End Date;Project Intent;Common Names / Keywords / Aliases;Project Document Repository;External Vocabularies;Products;Start Date
706;Electronic Nutrition Care Process Record System (ENCPRS) Functional Profile.;Electronic Health Records Work Group;;Administrative;Constantina Papoutsakis, Academy of Nutrition and Dietetics;Archived;08/12/2017;22/11/2010;Ballot - STU to Normative;2021 May WGM/Ballot;Revise Current Standard;"EHR-S Electronic Nutrition Care Process Record System (ENCPRS) Functional Profile, R2; Nutrition Profile ";The Wiki is: http://wiki.hl7.org/index.php?title=Product_EHR_ENCPRS_FP ;Yes;Electronic Health Record;18/10/2010 08:00
705;HL7 CG-omics Domain Analysis Model;Clinical Genomics Work Group;;Clinical;"Joyce Hernandez; Philip M. Pochon";Archived;04/02/2011;14/02/2011;Ballot - Informative;2016 May WGM/Ballot;Supplement to a Current Standard;;"Models will be located in HL7 GFORGE, meeting minutes and other supporting documents in HL7 WIKI.
GFORGE: http://gforge.hl7.org/gf/project/genomics/
Wiki: http://wiki.hl7.org/index.php?title=Models_-_Domain_Information_and_Domain_Analysis";;Domain Analysis Model (DAM);18/10/2010 08:00
704;Public Health Functional Profile (PHFP) Project;Electronic Health Records Work Group;Public Health Work Group;Administrative;"Hetty Khan; Michelle Williamson; Dr. Anna Orlova; Lori Fourquet";Archived;10/11/2010;29/11/2010;Ballot - Informative;2013 May WGM/Ballot;Create New Standard;;"http://wiki.hl7.org/index.php?title=Main_Page); 
http://healthlevelseven.projectinsight.net/l.aspx?ReturnUrl=%2fdefault.aspx";;Electronic Health Record;18/10/2010 08:00
707;2011 HL7 Strategic Initiatives;Board of Directors Work Group;;None;Bob Dolin / Chuck Jaffe;Archived;;;Ballot - Comment;2011 Jan WGM/Ballot;N/A (Project not directly related to an HL7 Standard);;http://www.hl7.org/documentcomments/index.cfm;;- Non Product Project -;20/10/2010 08:00
715;2011 Annual Updates to the Project Scope Statement Template;Project Services Work Group;;Organizational Support;Dave Hamill;Archived;08/11/2010;15/11/2010;;2011 Jan WGM/Ballot;N/A (Project not directly related to an HL7 Standard);;"PS WG GForge Draft Docs page:
http://gforge.hl7.org/gf/project/psc/docman/?subdir=79";;- Non Product Project -;28/10/2010 08:00
708;HL7 Enterprise-Wide Education Strategic Plan;Education Work Group;;Organizational Support;AbdulMalik Shakir;Archived;08/11/2010;15/11/2010;- Other -;2014 Jan WGM/Ballot;N/A (Project not directly related to an HL7 Standard);;HL7 Wiki - Under Education Workgroup Projects;;- Non Product Project -;28/10/2010 08:00
710;Reaffirmation of Previous Normative CMET Ballots;Modeling and Methodology Work Group;;Infrastructure;Woody Beeler;Archived;02/11/2010;08/11/2010;Ballot - Normative (no STU);2012 Jan WGM/Ballot;Reaffirmation of a standard;;http://wiki.hl7.org/index.php?title=CMET_Reconfirmation_Ballot;;V3 Messages-Infrastructure;02/11/2010 08:00
711;Self-Displaying CDA Documents;Structured Documents Work Group;;Administrative;Keith W. Boone;Archived;10/11/2010;15/11/2010;Ballot - STU;2012 May WGM/Ballot;Supplement to a Current Standard, IG;;http://wiki.hl7.org/index.php?title=Self_Displaying_CDA;;V3 Messages-Clinical;03/11/2010 08:00
722;Annual Updates to the Project Approval Process (Target January of each year);Project Services Work Group;;Organizational Support;PS WG Cochairs;Archived;;;;2015 Jan WGM/Ballot;N/A (Project not directly related to an HL7 Standard);;;;- Non Product Project -;11/11/2010 08:00
709;2010 Post Nov Harmonization V3 Repository updates;Board of Directors Work Group;;None;"Tec Klein; Russ Hamm";Archived;22/10/2010;22/10/2010;Vendor Contract;2011 Jan WGM/Ballot;N/A (Project not directly related to an HL7 Standard);;;;- Non Product Project -;12/11/2010 08:00
724;Semantic Health Information Performance and Privacy Standard (SHIPPS);Community-Based Care and Privacy (CBCP) Work Group;Electronic Health Records Work Group, Structured Documents Work Group;Clinical;Mary Ann Juurlink;Archived;14/02/2011;14/03/2011;Ballot - STU;2018 Jan WGM/Ballot;Revise Current Standard, Supplement to a Current Standard;;"GForge: http://gforge.hl7.org/gf/project/cbcc/docman/?subdir=297 
CBCC Work Group Wiki: http://wiki.hl7.org/index.php?title=Community-Based_Collaborative_Care ";;"Electronic Health Record; V3 Foundation-Vocab Domains & Value Sets";15/11/2010 08:00
712;HL7 Readiness to Support Meaningful Use;Government Projects Work Group;Project Services Work Group, Technical Steering Committee;Clinical;Mitra Rocca;Archived;21/02/2011;;- Other -;2015 Jan WGM/Ballot;N/A (Project not directly related to an HL7 Standard);;http://wiki.hl7.org/index.php?title=Government_Projects;;- Non Product Project -;23/11/2010 08:00
691;Update EHR Child Health Functional Profile for Release 2;Patient Care Work Group;;Clinical;Child Health WG co-chairs;Archived;;;Ballot - Normative (no STU);2021 May WGM/Ballot;Revise Current Standard;;http://www.hl7.org/Special/committees/pedsdata/index.cfm;;Electronic Health Record;29/11/2010 08:00
310;Immunization Domain Analysis Model;Public Health Work Group;;Clinical;Rob Savage;Archived;14/03/2011;28/03/2011;Ballot - Informative;2013 Sept WGM/Ballot;Supplement to a Current Standard;;http://wiki.hl7.org/index.php?title=Immunization_Project;;;01/12/2010 08:00
726;Cardiology Domain Analysis Model Release 2;Clinical Interoperability Council Work Group;No Selection;Clinical;Brian McCourt;Archived;30/12/2010;07/02/2011;Ballot - Informative;2013 May WGM/Ballot;Create New Standard;;"HL7 Wiki: http://wiki.hl7.org/index.php?title=CIC
CIC web page on www.HL7.org";;Domain Analysis Model (DAM);07/12/2010 08:00
728;HL7/IHE Health Story IG Consolidation;Structured Documents Work Group;Patient Care Work Group;Infrastructure;Brett Marquard, Sarah Gaunt;Active Project (Resources assigned to pjt);22/06/2012;02/07/2012;Ballot - STU to Normative;2025 Sept WGM/Ballot;IG;;"www.cdatools.org; http://wiki.hl7.org/index.php?title=Structured_Documents";;V3 Documents-Clinical (e.g. CDA);13/12/2010 08:00
752;Publish CDA IGs from Tooling;Structured Documents Work Group;Clinical Genomics Work Group, Publishing Work Group, Tooling Work Group;Administrative;Pete Gilbert;Archived;22/12/2010;08/01/2011;- Other -;2011 May WGM/Ballot;N/A (Project not directly related to an HL7 Standard);;"Tools and support documentation will be available at (TBD)
A project Wiki Page will be created beneath the SDWG Wiki. ";;- Non Product Project -;28/12/2010 08:00
730;CCR-CCD Mapping and Transformation;Structured Documents Work Group;Conformance Work Group;Administrative;Robert Worden;Archived;;;Ballot - Informative;2011 Sept WGM/Ballot;IG;;http://wiki.hl7.org/index.php?title=Mappings_and_Translations;;V3 Documents-Clinical (e.g. CDA);31/12/2010 08:00
391;Increase revenue targets (Roadmap Pjt #19);Strategic Initiative Committee;;None;CEO, (Roadmap Leader: CEO);Archived;;;;2011 May WGM/Ballot;- OTHER -;;;;- Non Product Project -;01/01/2011 08:00
769;Beeler Consulting for 2011;Board of Directors Work Group;No Selection;None;Woody Beeler;Archived;;;Vendor Contract;2012 Jan WGM/Ballot;N/A (Project not directly related to an HL7 Standard);;;;- Non Product Project -;03/01/2011 08:00
731;Preoperative Anesthesiology Domain Analysis Model, Release 1;Anesthesia Work Group;Child Health Work Group, Clinical Interoperability Council Work Group;Clinical;"Mead Walker ; Anita Walden";Archived;10/01/2011;31/01/2011;Ballot - Informative;2014 Sept WGM/Ballot;Create New Standard;;Project Insight, the GAS WG web page on www.HL7.org;;Domain Analysis Model (DAM);10/01/2011 08:00
733;Arden Syntax v2.8;Arden Syntax Work Group;No Selection;Administrative;Robert Jenders ;Archived;21/02/2011;28/02/2011;Ballot - Normative (no STU);2011 Sept WGM/Ballot;Revise Current Standard;;http://wiki.hl7.org/index.php?title=Arden_Syntax_Work_Group;;Arden Syntax;21/01/2011 08:00
735;HL7 Version 2.5.1 IG: Vital Records Death Reporting, Release 1 (US Realm);Public Health Work Group;Orders and Observations Work Group;Clinical;Michelle Williamson;Archived;17/02/2011;14/03/2011;Ballot - STU;2017 May WGM/Ballot;Supplement to a Current Standard, IG;;"http://wiki.hl7.org/index.php?title=PHER_Vital_Records-Related_Activities 
Stakeholder communications: PHER's document page on www.HL7.org, PHER listserv";;V2 Messages-Clinical;21/01/2011 08:00
734;Arden Syntax v2.9;Arden Syntax Work Group;No Selection;Administrative;Robert A Jenders;Archived;21/02/2011;28/02/2011;Ballot - Normative (no STU);2012 Sept WGM/Ballot;Revise Current Standard;;http://wiki.hl7.org/index.php?title=Arden_Syntax_Work_Group;;Arden Syntax;21/01/2011 08:00
736;Patient Encounter Messaging;Patient Administration Work Group;No Selection;Administrative;Gregg Seppala;Archived;21/02/2011;28/02/2011;Ballot - STU;2013 Sept WGM/Ballot;;;"Project documents: http://gforge.hl7.org/gf/project/patient-admin/docman/?subdir=311
Project Wiki: http://wiki.hl7.org/index.php?title=PA_Patient_Encounter";;;24/01/2011 08:00
737;HL7 Version 2.5.1 IG: Electronic Laboratory Reporting to Public Health, Release 2 (US Realm);Public Health Work Group;Conformance Work Group, Orders and Observations Work Group;Clinical;Rita Altamore (WA State DOH), Eric Haas (Contractor for APHL), Riki Merrick (Contractor for APHL);Archived;15/02/2013;25/02/2013;Ballot - STU to Normative;2017 Jan WGM/Ballot;IG;;http://wiki.hl7.org/index.php?title=ELRR2;;V2 Messages-Clinical;25/01/2011 08:00
755;UPDATE OF CERTIFICATION TESTING TO HL7 V2.7;Education Work Group;No Selection;Organizational Support;Ted Klein;Archived;;;- Other -;2012 Jan WGM/Ballot;N/A (Project not directly related to an HL7 Standard);;;;- Non Product Project -;26/01/2011 08:00
754;UPDATE OF RIM TESTING TO HL7 RIM 2.34;Education Work Group;No Selection;Organizational Support;Virginia Lorenzi ;Archived;;;;2011 Sept WGM/Ballot;N/A (Project not directly related to an HL7 Standard);;;;- Non Product Project -;26/01/2011 08:00
753;Academia Engagement Project;Education Work Group;Marketing Work Group;Organizational Support;"AbdulMalik Shakir; Mollie Ullman-Cullere; Jill Kaufmann; Supten Sarbadhikari";Archived;06/03/2011;21/03/2011;- Other -;2012 Jan WGM/Ballot;N/A (Project not directly related to an HL7 Standard);;http://wiki.hl7.org/index.php?title=Education_Committee;;- Non Product Project -;26/01/2011 08:00
597;HL7 Website Enhancements - Release 7 (May 2011);Publishing, Electronic Services and Tools Work Group;;Organizational Support;"WG CoChairs; Mike Kingery";Archived;;;- Other -;2011 May WGM/Ballot;;;;;- Non Product Project -;01/02/2011 08:00
719;Subject Data Validation Service Functional Model;Biomedical Research and Regulation Work Group;;Clinical;RCRIM WG;Archived;;;Ballot - STU;2013 Jan WGM/Ballot;Create New Standard;;;;V3 Services-Web Services (OMG);01/02/2011 08:00
718;Clinical Study Functional Profiles;Biomedical Research and Regulation Work Group;;Clinical;RCRIM WG;Archived;;;Ballot - STU;2015 Jan WGM/Ballot;Supplement to a Current Standard;;;;Electronic Health Record;01/02/2011 08:00
739;HL7 EHR FM Records Management and Evidentiary Support Functional Profile Implementation Guidance - Phase 1 - Environmental Scan and Analysis;Electronic Health Records Work Group;Structured Documents Work Group;Administrative;Ioana Singureanu;Archived;21/02/2011;28/02/2011;Ballot - Informative;2012 Jan WGM/Ballot;Supplement to a Current Standard;;"GForge: http://gforge.hl7.org/gf/project/ehrlegal/
Wiki: http://wiki.hl7.org/index.php?title=Evidentiary_Medical_Records
Homepage: http://www.hl7.org/Special/committees/ehr/index.cfm";;Electronic Health Record;03/02/2011 08:00
738;Diet and Nutrition Orders Domain Analysis Model;Orders and Observations Work Group;Patient Care Work Group, Pharmacy Work Group;Administrative;Margaret Dittloff, Jean Duteau;Archived;21/02/2011;28/02/2011;Ballot - Informative;2013 Sept WGM/Ballot;Create New Standard;;"HL7 Wiki or other location per Orders and Observations committee directives.
http://wiki.hl7.org/index.php?title=Orders_%26_Observations_WG";;Domain Analysis Model (DAM);03/02/2011 08:00
740;SWOT Work for Project Services Work Group;Project Services Work Group;;Organizational Support;Project Services Cochairs;Archived;;;;2013 Jan WGM/Ballot;;;;;;04/02/2011 08:00
741;Harmonization Process Work by Project Services WG;Project Services Work Group;;Organizational Support;Project Services Work Group Cochairs;Archived;;;;2011 Sept WGM/Ballot;;;;;;04/02/2011 08:00
744;Masterfiles Re-affirmation;Infrastructure and Messaging Work Group;No Selection;Infrastructure;Anthony Julian;Archived;08/02/2011;14/02/2011;Ballot - Normative (no STU);2011 Sept WGM/Ballot;Reaffirmation of a standard;;http://wiki.hl7.org/index.php?title=V3_%E2%80%93_Master_File/Registry_R1_Documents;;V3 Messages-Infrastructure;08/02/2011 08:00
743;Guidance for the use of Terminology Post-Coordinated Expressions in HL7;Vocabulary Work Group;;Infrastructure;Ted Klein, Jim Case, Beverly Knight;Archived;14/02/2011;28/02/2011;Ballot - Informative;2012 Sept WGM/Ballot;IG;;http://wiki.hl7.org/index.php?title=Vocabulary;;V3 Foundation-Vocab Domains & Value Sets;08/02/2011 08:00
742;Model Automated Exchange (MAX) for UML Models;Publishing, Electronic Services and Tools Work Group;Clinical Interoperability Council Work Group;Organizational Support;Stacy Berger;Archived;04/02/2011;;- Other -;2015 Sept WGM/Ballot;N/A (Project not directly related to an HL7 Standard);;TBD, Presence to be specified by tooling committee. It is expected that MAX will be hosted through a combination of a WIKI and gForge;;- Non Product Project -;08/02/2011 08:00
745;Pressure Ulcer Prevention Domain Analysis Model;Patient Care Work Group;;Clinical;Jay Lyle;Archived;22/02/2011;28/02/2011;Ballot - Informative;2014 Sept WGM/Ballot;Create New Standard;;"Project materials will be kept on the HL7 project wiki. 
http://wiki.hl7.org/index.php?title=Pressure_Ulcer_Prevention";;Domain Analysis Model (DAM);10/02/2011 08:00
551;EHR System Functional Model Release 2.0 (ISO Project);Electronic Health Records Work Group;;Administrative;"Pat Van Dyke; Don Mon; John Ritter; Helen Stevens; Gary Dickinson";Archived;18/02/2012;27/02/2012;ISO JIC Ballot Project;2014 May WGM/Ballot;Revise Current Standard;;www.hl7.org/wiki/ehr/ehrR2;;;10/02/2011 08:00
807;Preparation of SAIF Book for Informative Ballot;Architectural Review Work Group;Technical Steering Committee;None;Charlie Mead;Archived;14/02/2011;14/02/2011;Ballot - STU;2015 Sept WGM/Ballot;Create New Standard;;ArB Wiki: http://wiki.hl7.org/index.php?title=Architecture_Board;;SAIF Program;11/02/2011 08:00
746;Preparation of SAIF Book for Informative Ballot;Architectural Review Work Group;Technical Steering Committee;None;Charlie Mead ;Archived;14/02/2011;14/02/2011;Ballot - STU;2012 Jan WGM/Ballot;Create New Standard;;ArB Wiki: http://wiki.hl7.org/index.php?title=Architecture_Board;;SAIF Program;11/02/2011 08:00
749;TSC Retrospective Self-Assessment Based on T3F Recommendations;Technical Steering Committee;Domain Experts Steering Division, Foundation and Technology Steering Division, Structure and Semantic Design Steering Division, Technical and Support Services Steering Division;Clinical, Infrastructure, Administrative, Organizational Support;G W Beeler, Jr.;Archived;28/02/2011;;- Other -;2012 May WGM/Ballot;N/A (Project not directly related to an HL7 Standard);;http://gforge.hl7.org/gf/project/tsc/ ;;- Non Product Project -;14/02/2011 08:00
748;Work with Vocab re: process to publish vocab changes 3x/year;Project Services Work Group;;Organizational Support;Project Services Cochairs;Archived;;;;2015 May WGM/Ballot;;;;;;14/02/2011 08:00
747;Create Education for Project Services Related Topics;Project Services Work Group;;Organizational Support;PS Cochairs, Dave Hamill;Archived;;;- Other -;2012 Jan WGM/Ballot;;;;;;14/02/2011 08:00
751;SAIF Architecture Program;Technical Steering Committee;Architectural Review Work Group;None;Austin Kreisler;Archived;21/02/2011;28/02/2011;- Other -;2015 Jan WGM/Ballot;N/A (Project not directly related to an HL7 Standard);;"Add link to wiki:
SAIF AP list server: ";;SAIF Program;21/02/2011 08:00
756;QDM-based Health Quality Measure Format;Clinical Quality Information Work Group;Clinical Decision Support Work Group, Structured Documents Work Group;Clinical;Yan Heras;Archived;06/10/2016;24/10/2016;Ballot - STU;2020 May WGM/Ballot;Revise Current Standard;QDM-based HQMF;The Project Repository Location is located at: http://www.hl7.org/implement/standards/product_brief.cfm?product_id=346 ;No;;24/02/2011 08:00
757;Decision Support Service (DSS) Project;Clinical Decision Support Work Group;Services Oriented Architecture Work Group;Infrastructure;Kensaku Kawamoto, MD, PhD;Archived;19/08/2011;29/08/2011;Ballot - Normative (no STU);2014 Jan WGM/Ballot;Revise Current Standard;;http://hssp-dss.wikispaces.com/;;V3 Services-Web Services (OMG);25/02/2011 08:00
758;HL7 Version 3 Standard: Transport Specification - MLLP, Release 2;Implementable Technology Specifications Work Group;No Selection;Infrastructure;Paul Knapp;Archived;08/03/2011;14/03/2011;Ballot - Normative (no STU);2012 Sept WGM/Ballot;Reaffirmation of a standard;;http://wiki.hl7.org/index.php?title=ITS_WG;;V3 Messages-Infrastructure;28/02/2011 08:00
759;HL7 Version 3 Standard: Transport Specification - ebXML using ebMS 2.0, Release 1;Implementable Technology Specifications Work Group;No Selection;Infrastructure;Paul Knapp;Archived;08/03/2011;14/03/2011;Ballot - Normative (no STU);2012 Sept WGM/Ballot;Revise Current Standard;;http://wiki.hl7.org/index.php?title=ITS_WG;;V3 Messages-Infrastructure;28/02/2011 08:00
760;Backwards compatible ITS (R2B);Implementable Technology Specifications Work Group;No Selection;Infrastructure;Dale Nelson;Archived;08/03/2011;21/03/2011;Ballot - Normative (no STU);2015 Jan WGM/Ballot;Revise Current Standard;;http://wiki.hl7.org/index.php?title=ITS_WG;;V3 Messages-Infrastructure;28/02/2011 08:00
761;Information Model Metadata Documentation;Modeling and Methodology Work Group;Vocabulary Work Group;Infrastructure;Lloyd McKenzie;Archived;;;Ballot - Informative;2016 Jan WGM/Ballot;Supplement to a Current Standard;;MnM Project Wiki: http://wiki.hl7.org/index.php?title=MnM;;V3 Documents-Knowledge;04/03/2011 08:00
764;SAIF Pilot Coordination;Technical Steering Committee;Architectural Review Work Group, Project Services Work Group;None;Project Services Work Group:  Rick Haddorff;Archived;21/03/2011;28/03/2011;- Other -;2014 May WGM/Ballot;N/A (Project not directly related to an HL7 Standard);;http://gforge.hl7.org/gf/project/psc/;;SAIF Program;07/03/2011 08:00
762;2011 Post Harmonization Repository Update;Board of Directors Work Group;No Selection;None;Karen Van Hentenryck;Archived;01/03/2011;01/03/2011;Vendor Contract;- Select One -;N/A (Project not directly related to an HL7 Standard);;;;- Non Product Project -;07/03/2011 08:00
763;HL7 SAIF IG;Technical Steering Committee;Architectural Review Work Group, Conformance Work Group, Electronic Health Records Work Group, Modeling and Methodology Work Group, Orders and Observations Work Group, Services Oriented Architecture Work Group, Structured Documents Work Group;None;Lloyd McKenzie;Archived;14/03/2011;21/03/2011;Ballot - Informative;2017 Sept WGM/Ballot;;;http://wiki.hl7.org/index.php?title=Category:SAIF_Artifact_Definition;;SAIF Program;07/03/2011 08:00
765;Project Health Metrics;Project Services Work Group;Technical Steering Committee;Organizational Support;David Hamill;Archived;21/03/2011;28/03/2011;- Other -;2012 Sept WGM/Ballot;N/A (Project not directly related to an HL7 Standard);;"Suggestions for Project Health Metrics to capture can be entered into a TSC GForge Tracker, where a specific Tracker folder has been set up:
<a href=""http://gforge.hl7.org/gf/project/tsc/tracker/?action=TrackerItemBrowse&amp;tracker_id=628"">http://gforge.hl7.org/gf/project/tsc/tracker/?action=TrackerItemBrowse&amp;tracker_id=628

Project Health Metrics that have been released to production during the project's life can be viewed on GForge, via the TSC's File Page:
<a href=""http://gforge.hl7.org/gf/project/tsc/frs/?action=FrsReleaseBrowse&amp;frs_package_id=98"">http://gforge.hl7.org/gf/project/tsc/frs/?action=FrsReleaseBrowse&amp;frs_package_id=98";;- Non Product Project -;11/03/2011 08:00
766;HL7 Business Plan contract;Board of Directors Work Group;No Selection;None;"Virginia Riehl; Karen Van Hentenryck";Archived;;;;2013 Jan WGM/Ballot;N/A (Project not directly related to an HL7 Standard);;;;- Non Product Project -;14/03/2011 08:00
770;HL7 Child Health Neonatology Profile for EHR Systems, v 1.0;Patient Care Work Group;Electronic Health Records Work Group;Clinical;Joy Kuhl, Andy Spooner;On Hold;28/03/2011;11/04/2011;Ballot - STU;2022 Sept WGM/Ballot;Create New Standard;;"Work Group's web page on www.hl7.org and HL7 Project Insight.
http://www.hl7.org/Special/committees/pedsdata/index.cfm";;Electronic Health Record;29/03/2011 08:00
417;IG for users implementing HL7 v3 data interchange standard (Roadmap Pjt #53);Strategic Initiative Committee;;None;TBD (Consider funding to contract this task), (Roadmap Leader: CTO);Archived;;;;2011 Sept WGM/Ballot;;;;;- Non Product Project -;01/04/2011 08:00
778;GForge Adminitrator's Guide;Board of Directors Work Group;No Selection;None;"Karen Van Hentenryck; Wilfred Bonney";Archived;01/05/2011;01/05/2011;Vendor Contract;2011 Sept WGM/Ballot;N/A (Project not directly related to an HL7 Standard);;;;- Non Product Project -;02/05/2011 08:00
779;HL7 Internal Tooling Structure, Metadata and Semantics documentation in DITA;Board of Directors Work Group;No Selection;None;"Karen Van Hentenryck; Wilfred Bonney";Archived;16/05/2011;16/05/2011;Vendor Contract;2011 Sept WGM/Ballot;N/A (Project not directly related to an HL7 Standard);;;;- Non Product Project -;16/05/2011 08:00
775;Create a three-workgroup DAM for claims attachments;Financial Management Work Group;Payer/Provider Info Exchange Work Group, Structured Documents Work Group;Administrative;Financial Management Co-chairs;Archived;;;;2014 May WGM/Ballot;;;;;;27/05/2011 08:00
776;Financial Management Claims and Reimbursement Reaffirmation Ballot;Financial Management Work Group;;Administrative;Kathleen Connor;Archived;06/07/2011;18/07/2011;Ballot - Normative (no STU);2012 May WGM/Ballot;Reaffirmation of a standard;;http://www.hl7.org/Special/committees/fm/projects.cfm;;V3 Documents-Administrative (e.g. SPL);31/05/2011 08:00
777;Financial Management Account and Billing;Financial Management Work Group;No Selection;Administrative;Kathleen Connor;Archived;06/07/2011;18/07/2011;Ballot - Normative (no STU);2012 May WGM/Ballot;Reaffirmation of a standard;;http://www.hl7.org/Special/committees/fm/projects.cfm;;V3 Documents-Administrative (e.g. SPL);31/05/2011 08:00
598;HL7 Website Enhancements - Release 8 (Sept 2011);Publishing, Electronic Services and Tools Work Group;;Organizational Support;Electronic Services Work Group Co-Chairs;Archived;;;- Other -;2011 Sept WGM/Ballot;;;;;- Non Product Project -;01/06/2011 08:00
782;Lightweight CCOW;Infrastructure and Messaging Work Group;;Administrative;David Fusari;Archived;;;Ballot - Normative (no STU);2014 Jan WGM/Ballot;Revise Current Standard;;;;CCOW;06/06/2011 08:00
784;Adding Public Health Reporting Requirements to HQMF;Public Health Work Group;Structured Documents Work Group;Clinical;"Anna Orlova; Lori Reed-Fourquet";Archived;06/06/2011;13/06/2011;Ballot - STU;2013 Sept WGM/Ballot;;;"HL7 Project Insight and the PHER Work Group's WIKI Page at: 
http://wiki.hl7.org/index.php?title=Public_Health_and_Emergency_Response_work_group_(PHER). ";;;06/06/2011 08:00
783;HL7 hData Record Format;Services Oriented Architecture Work Group;Implementable Technology Specifications Work Group;Infrastructure;Gerald Beuchelt;Archived;21/06/2011;11/07/2011;Ballot - STU;2014 Sept WGM/Ballot;Create New Standard;;http://wiki.hl7.org/index.php?title=HData;;V3 Services-Web Services (OMG);06/06/2011 08:00
789;HL7 V2.x / DICOM IG for Pathology Order Messages and Use of DICOM Image References;Imaging Integration Work Group;;Administrative;Imaging Integration Work Group Co-Chairs;Archived;;;;2013 Jan WGM/Ballot;;;;;;15/06/2011 08:00
787;SopInstance Reference minimal Update;Imaging Integration Work Group;;Administrative;Imaging Integration Work Group Co-Chairs;Archived;;;;2013 Jan WGM/Ballot;;;;;;15/06/2011 08:00
788;HL7 V2.x / DICOM IG for Pathology Specimen Identifiers and Labels;Imaging Integration Work Group;;Administrative;Imaging Integration Work Group Co-Chairs;Archived;;;;2013 Jan WGM/Ballot;;;;;;15/06/2011 08:00
790;v3 Medical Records Reaffirmation Ballot;Structured Documents Work Group;;Administrative;Pete Gilbert;Archived;19/08/2011;29/08/2011;Ballot - Normative (no STU);2012 Jan WGM/Ballot;Reaffirmation of a standard;;The supporting documents will be on the HL7 website under the Structured Documents Workgroup.;;V3 Messages-Clinical;23/06/2011 08:00
794;Workgroup Scratchpad Webspace;Publishing, Electronic Services and Tools Work Group;Pharmacy Work Group, Publishing Work Group;Organizational Support;Jean-Henri Duteau;Archived;18/07/2011;25/07/2011;- Other -;2017 May WGM/Ballot;N/A (Project not directly related to an HL7 Standard);;N/A;;- Non Product Project -;28/06/2011 08:00
791;Resource Directory Wiki;Process Improvement Work Group;;Organizational Support;Helen Stevens, Margie Kennedy;Archived;24/10/2011;31/10/2011;;2014 May WGM/Ballot;N/A (Project not directly related to an HL7 Standard);;All documents should be stored on PIC page on HL7.org and PIC wiki at wiki.hl7.org. ;;- Non Product Project -;28/06/2011 08:00
