Number;Name;Sponsor(s);Co-Sponsor(s);Steering Division;Project Facilitator;Status;SD Approval Date;TSC Approval Date;Type;Project End Date;Project Intent;Common Names / Keywords / Aliases;Project Document Repository;External Vocabularies;Products;Start Date
1403;"FHIR Ballot Coordinator & Facilitators (FY2018); FHIR IG Publication Coordinator (FY2019-20) (ONC/Grant Project)";Board of Directors Work Group;;None;"David Hamill, HL7 PMO; Wayne Kubick, HL7 CTO";Archived;;;Vendor Contract;2020 Sept WGM/Ballot;Revise Current Standard;;"On the Confluence ONC Grant Project Page:
https://confluence.hl7.org/display/PMO/ONC+Grant+Project+Page

On the HL7 Wiki Page titled: FHIR: Enhancing Implementation (ONC Grant Project) at: 
http://wiki.hl7.org/index.php?title=FHIR:_Enhancing_Implementation_(ONC_Grant_Project)";N/A;"FHIR IG; FHIR Profile";20/02/2018 08:00
1407;HL7 Health Service Reference Architecture (HL7-HSRA);Services Oriented Architecture Work Group;Architectural Review Work Group;Infrastructure;Stefano Lotti, Vincent McCauley;Active Project (Resources assigned to pjt);01/10/2018;30/09/2019;Ballot - STU;2023 Sept WGM/Ballot;Create New Standard;HL7-HSRA, Services, SOA, Reference Architecture;http://wiki.hl7.org/index.php?title=HL7-HSRA;N/A;Logical Model;06/03/2018 08:00
1409;MedicationKnowledge and Medication Logical Model - FHIR;Pharmacy Work Group;Orders and Observations Work Group;Clinical;Melva Peters;Archived;26/04/2018;22/06/2018;Ballot - STU to Normative;2020 Jan WGM/Ballot;Revise Current Standard;Pharmacy, Medication, Medication Knowledge Base, Drug Information, Medication Pattern, Medication Logical Model;"HL7's SVN repository.
<a href=""https://gforge.hl7.org/gf/project/fhir/scmsvn/?action=browse&amp;path=%2Ftrunk%2Fbuild%2F&amp;sortby=date&amp;sortdir=down"">https://gforge.hl7.org/gf/project/fhir/scmsvn/?action=browse&amp;path=%2Ftrunk%2Fbuild%2F&amp;sortby=date&amp;sortdir=down";Yes;;07/03/2018 08:00
1410;FHIR Bulk Data Access & Push (ONC Grant Project);Board of Directors Work Group;No Selection;None;Boston Children's Hospital;Archived;;;Vendor Contract;2019 Jan WGM/Ballot;;Bulk Data and Push;"On the HL7 Wiki Page titled: FHIR: Enhancing Implementation (ONC Grant Project) at: 
http://wiki.hl7.org/index.php?title=FHIR:_Enhancing_Implementation_(ONC_Grant_Project)";N/A;;09/03/2018 08:00
1315;Imaging Integration 3-Year Plan;Imaging Integration Work Group;No Selection;Administrative;Imaging Integration Work Group Co-Chairs;3-Year Plan Item;;;Ballot - STU to Normative;2024 Sept WGM/Ballot;;;;N/A;;12/03/2018 08:00
1412;C-CDA on FHIR Mappings and Profile Updates;Structured Documents Work Group;FHIR Infrastructure Work Group;Infrastructure;Lisa Nelson;Archived;22/03/2018;;Ballot - STU to Normative;2025 Sept WGM/Ballot;Revise Current Standard, Supplement to a Current Standard;"C-CDA on FHIR Mappings and Profile Updates; CCDA on FHIR Mappings";"http://wiki.hl7.org/index.php?title=C-CDA_on_FHIR_Mappings_and_Profile_Updates
Project may be moved to confluence but a pointer to the confluence site would be placed in the wiki site as a forward reference to the new location.";Yes;"FHIR IG; FHIR Profile; Guidance (e.g. Companion Guide, Cookbook, etc); Logical Model";21/03/2018 08:00
1413;Technical Reference Domain Analysis Model (RDAM) Mapping;Clinical Information Modeling Initiative Work Group;Clinical Interoperability Council Work Group, Electronic Health Records Work Group, Public Health Work Group;Clinical;Steve Hufnagel & Nona Hall;Archived;10/07/2018;;Ballot - Informative;2022 Sept WGM/Ballot;White Paper (Balloted Informative), Supplement to a Current Standard;Healthcare Reference Domain Analysis Model (RDAM);CIMI Wiki or Confluence;Yes;White Paper;23/03/2018 08:00
1414;Reference Domain Analysis Model (RDAM) Product Line Processes;Technical Steering Committee;;None;Lorraine Constable;Archived;;;Investigative Project (PSS-Lite);2018 Sept WGM/Ballot;N/A (Project not directly related to an HL7 Standard);Healthcare Reference Domain Analysis Model (RDAM);"http://wiki.hl7.org/index.php?title=Template:Project_Page.
RDAM.HL7.Org";Yes;Guidance (e.g. Companion Guide, Cookbook, etc);23/03/2018 08:00
1418;Support for FHIR R4 Ballot Processing (ONC/Grant Project);Board of Directors Work Group;;None;Jean Duteau, Marc Duteau;Archived;;;Vendor Contract;2018 May WGM/Ballot;N/A (Project not directly related to an HL7 Standard);GForge FHIR Ballot Processing;"Deliverables will reside on the HL7 Wiki at:
http://wiki.hl7.org/index.php?title=FHIR:_Enhancing_Implementation_(ONC_Grant_Project)";N/A;"FHIR IG; FHIR Profile";11/04/2018 08:00
1416;Exploration of FHIR resources to support of IDMP 11238/19844 Substances Standard and Technical Specification.;Biomedical Research and Regulation Work Group;Orders and Observations Work Group, Pharmacy Work Group;Clinical;Mary-Ann Slack (FDA), Panagiotis Telonis (EMA), Boris Brodsky (FDA);Archived;;;Ballot - STU to Normative;2019 May WGM/Ballot;Supplement to a Current Standard;ISO IDMP 11238 and 19844 Substances FHIR resources. 'SubstanceSpecification' resource, proposed name.;"Resource content will be maintained in http://gforge.hl7.org/svn/fhir/trunk/source. Additional project tracking and supporting project documents will be kept/referenced from here:
http://www.hl7.org/Special/committees/rcrim/index.cfm";No;FHIR Resources;30/04/2018 08:00
1415;Attachments Frequently asked Questions (FAQ) living document;Payer/Provider Info Exchange Work Group;Structured Documents Work Group;Administrative;Christol Green, Durwin Day;Archived;19/06/2018;01/08/2018;Ballot - Informative;2019 May WGM/Ballot;White Paper (Balloted Informative);FAQs, Attachments, ;http://gforge.hl7.org/svn/design-repos/trunk/rim-workspace;N/A;;30/04/2018 08:00
1419;C-CDA to FHIR Mapping (ONC/Grant Project);Board of Directors Work Group;;None;Jean Duteau, Joginder Madra, Marc Duteau, Lisa Nelson;Archived;;;Vendor Contract;2018 Sept WGM/Ballot;N/A (Project not directly related to an HL7 Standard);CCDA to FHIR Mapping;"Deliverables will reside on the HL7 Wiki at:
http://wiki.hl7.org/index.php?title=FHIR:_Enhancing_Implementation_(ONC_Grant_Project)";N/A;"FHIR IG; FHIR Profile";02/05/2018 08:00
1310;BRIDG Model Update;Biomedical Research and Regulation Work Group;Orders and Observations Work Group;Clinical;Ed Helton;Archived;15/07/2018;01/08/2018;Ballot - Informative;2019 Jan WGM/Ballot;Revise Current Standard;BRIDG, BRIDG Model, Biomedical Research Integrated Domain Group Model;"BRIDG model home: https://bridgmodel.nci.nih.gov; 
BR&amp;R WG page: http://www.hl7.org/Special/committees/rcrim/index.cfm; 
BR&amp;R Wiki page: http://wiki.hl7.org/index.php?title=Biomedical_Research_and_Regulation_(BR%26R)";Don't Know;Domain Analysis Model (DAM);24/05/2018 08:00
1503;BRIDG Model Update  (BRIDG Release 5.3/HL7 BRIDG r5)  (v20190115v2.doc);Biomedical Research and Regulation Work Group;Orders and Observations Work Group;Clinical;Ed Helton;Informative - Reconcile;03/02/2019;11/02/2019;Ballot - Informative;2020 Jan WGM/Ballot;Revise Current Standard;BRIDG, BRIDG Model, Biomedical Research Integrated Domain Group Model;"BRR Confluence page: https://confluence.hl7.org/display/BRR/BRIDG+R5.3+Update

BRIDG model home: https://bridgmodel.nci.nih.gov; 
BR&amp;R WG page: http://www.hl7.org/Special/committees/rcrim/index.cfm; 
BR&amp;R Wiki page: http://wiki.hl7.org/index.php?title=Biomedical_Research_and_Regulation_(BR%26R)";Don't Know;Domain Analysis Model (DAM);24/05/2018 08:00
1422;FHIR Resources for Evidence-Based Medicine Knowledge Assets (EBMonFHIR);Clinical Decision Support Work Group;Biomedical Research and Regulation Work Group, Clinical Quality Information Work Group;Clinical;Brian Alper;Active Project (Resources assigned to pjt);04/06/2018;22/06/2018;Ballot - STU to Normative;2024 May WGM/Ballot;IG;EBMonFHIR;"Project page: http://wiki.hl7.org/index.php?title=EBMonFHIR 
Document repository: https://github.com/HL7/EBMonFHIR";Yes;"FHIR IG; FHIR Profile";30/05/2018 08:00
1420;HL7 Cross Paradigm Model Transformation Service;Services Oriented Architecture Work Group;Clinical Information Modeling Initiative Work Group, Community-Based Care and Privacy (CBCP) Work Group, Implementable Technology Specifications Work Group, Orders and Observations Work Group, Public Health Work Group, Security Work Group;Infrastructure;Matt Lord, Ken Lord, Sean Muir;STU - Request Publication;06/11/2018;08/02/2019;Ballot - STU;2023 Jan WGM/Ballot;Create New Standard;Cross Paradigm Transformation Service;Supporting project documents, deliverables, ballot reconciliation work and other project information will be kept at the SOA Confluence page: https://confluence.hl7.org/display/SOA;Yes;V3 Services-Web Services (OMG);30/05/2018 08:00
1421;CDA XSL update for CDA Release 2.1;Structured Documents Work Group;;Infrastructure;Lisa Nelson;Archived;05/06/2018;22/06/2018;Ballot - Comment;2019 Jan WGM/Ballot;Supplement to a Current Standard;CDA R2.1 Stylesheet;https://gforge.hl7.org/gf/project/strucdoc/frs/;Yes;V3 Documents-Clinical (e.g. CDA);30/05/2018 08:00
1423;Bidirectional Services eReferrals (BSeR);Public Health Work Group;Patient Care Work Group;Clinical;John W. Loonsk MD, CGI Federal and Consultant to CDC;Archived;23/05/2018;09/07/2018;Ballot - STU to Normative;2022 May WGM/Ballot;IG;Bidirectional Services eReferral (BSeR), clinical referral, services program, services organization, core referral data, program specific referral data;"Withdrawal Form: https://confluence.hl7.org/pages/viewpage.action?pageId=82915935

https://confluence.hl7.org/display/PHWG/Public+Health+Project+Roadmap

Per AMS: The project will produce its first set of artifacts in early July. We will be working with the PH cochairs to add our material to the site at that time. My understanding is that it will be added to the set of PHER projects current found under PHER Ballot Materials (http://wiki.hl7.org/index.php?title=PHER_ballot_materials)";Yes;"FHIR IG; FHIR Profile; Logical Model";30/05/2018 08:00
1424;Common Data Model Harmonization (CDMH) - FHIR IG;Biomedical Research and Regulation Work Group;Clinical Interoperability Council Work Group;Clinical;Nagesh Bashyam;STU - Reconcile;24/07/2018;27/09/2018;Ballot - STU to Normative;2020 Sept WGM/Ballot;Revise Current Standard, IG;"Common Data Model Harmonization (CDMH) - FHIR IG (IG); 
CDM - Common Data Model; 
OMOP - Observational Medical Outcomes Partnership";"https://github.com/HL7/daf-research ; 
HL7 BR&amp;R Wiki http://wiki.hl7.org/index.php?title=BRIDG#Website_and_Listserv";Yes;"FHIR IG; FHIR Profile";31/05/2018 08:00
1426;Womens Health Technology Coordinated Registry Network (CRN);Biomedical Research and Regulation Work Group;Clinical Interoperability Council Work Group, Orders and Observations Work Group;Clinical;Nagesh Bashyam / Martha Velezis / Rachael Roan/Richard Ballew;Informative - Reconcile;30/07/2018;27/09/2018;Ballot - STU to Normative;2020 Sept WGM/Ballot;IG;WHT (Womans Health Technology) CRN, Coordinated Registry Network ;"BR&amp;R Confluence: 
http://confluence.hl7.org/pages/viewpage.action?pageId=19136854";Don't Know;FHIR IG;31/05/2018 08:00
1425;CDISC Lab Semantics in FHIR (PSS in Confluence);Biomedical Research and Regulation Work Group;Orders and Observations Work Group;Clinical;Julie Evans,Hugh Glover;STU - Test Period/Accepting Comments;03/08/2018;18/02/2019;Ballot - STU to Normative;2022 Sept WGM/Ballot;IG;CDISC Lab Model Project ;http://confluence.hl7.org/display/BRR/CDISC+Lab+Semantics+-+FHIR+Investigation+and+Implementation+Guide;Yes;FHIR IG;31/05/2018 08:00
1427;HL7 CDA R2 IG: Gaps in Care Reporting;Clinical Quality Information Work Group;;Clinical;Bo Borgnakke;Archived;10/07/2018;01/08/2018;Ballot - STU to Normative;2021 Jan WGM/Ballot;Create New Standard, Supplement to a Current Standard;HEDIS Gaps in Care, Gaps in Care Reporting; http://wiki.hl7.org/index.php?title=Gaps_In_Care_Project;Yes;"FHIR Profile; FHIR Resources; Guidance (e.g. Companion Guide, Cookbook, etc)";01/06/2018 08:00
1429;FHIR IG for Data Exchange for Quality Measures (Da Vinci Pjt);Clinical Quality Information Work Group;Clinical Decision Support Work Group, Patient Care Work Group;Clinical;Bryn Rhodes, Gay Dolin, Robert Dieterle, Linda Michaelsen, Viet Nguyen;STU - Test Period/Accepting Comments;02/03/2020;16/03/2020;Ballot - STU to Normative;2023 May WGM/Ballot;IG;HEDIS Measure Reporting, MRP, FHIR IG, Medication Reconciliation, HEDIS, NCQA, Quality Measures, Gaps in Care;"https://confluence.hl7.org/display/DVP/Gaps+In+Care+Supporting+Materials

HL7-Managed Project Document Repository  HL7 organizational GitHub site
URL  https://github.com/HL7/davinci-deqm  ";Yes;FHIR IG;04/06/2018 08:00
1428;FHIR IG for Coverage Requirements Discovery;Financial Management Work Group;;Administrative;Robert Dieterle, Lenel James;STU - Test Period/Accepting Comments;13/06/2018;16/07/2018;Ballot - STU to Normative;2023 Jan WGM/Ballot;IG;Coverage Requirements Discovery, CRD, Payer requirements;HL7 Da Vinci Project Confluence page(s);Yes;FHIR IG;04/06/2018 08:00
1430;CIMI Analysis Normal Form (ANF) Project;Clinical Information Modeling Initiative Work Group;Clinical Decision Support Work Group;Infrastructure;Keith Campbell;Archived;20/08/2018;08/04/2019;Ballot - Comment;2020 Jan WGM/Ballot;Supplement to a Current Standard, IG;CIMI Analysis Normal Form / ANF;http://wiki.hl7.org/index.php?title=Clinical_Information_Modeling_Initiative_Work_Group. ;Yes;;04/06/2018 08:00
1434;FHIR Jira Ballot Support & Testing;Board of Directors Work Group;;None;Jean Duteau, Duteau Design, Inc.;Archived;;;Vendor Contract;2020 Jan WGM/Ballot;N/A (Project not directly related to an HL7 Standard);;;N/A;- Non Product Project -;02/07/2018 08:00
1431;Electronic Long-Term Services and Supports (eLTSS) Service Plan;Community-Based Care and Privacy (CBCP) Work Group;;Clinical;Irina Connelly, Laura Burkhart;STU - Test Period/Accepting Comments;15/07/2018;15/08/2018;Ballot - Informative;2024 May WGM/Ballot;IG;"eLTSS  electronic Long-Term Services and Supports
HCBS  Home and Community Based Services";;N/A;;02/07/2018 08:00
1432;Vital Records Domain Analysis Model specification mapping;Public Health Work Group;Electronic Health Records Work Group;Clinical;Hetty Khan;Archived;15/07/2018;01/08/2018;Ballot - Informative;2020 Jan WGM/Ballot;Revise Current Standard;"VR - Vital Records; DAM - Domain Analysis Model";http://www.hl7.org/Special/committees/pher/docs.cfm;Yes;Domain Analysis Model (DAM);03/07/2018 08:00
1433;Patient Reported Outcomes (PRO);FHIR Infrastructure Work Group;Biomedical Research and Regulation Work Group, Orders and Observations Work Group, Patient Care Work Group;Infrastructure;FHIR-Infrastructure;STU - Reconcile;09/08/2018;27/09/2018;Ballot - STU to Normative;2022 May WGM/Ballot;IG;PRO IG, Patient Reported Outcomes IG ;"ONC Tech Lab Page URL 
https://www.healthit.gov/techlab/standards_coordination.html";N/A;"FHIR IG; FHIR Profile";09/07/2018 08:00
1473;Import the Personal Health Record System Functional Model (PHR-S FM, ISO/HL7 16527) into the Functional Model/Profile Tool (EHR-S FM Profile Designer tool);Board of Directors Work Group;;None;William Goossen (Results 4 Care), Duteau Design, Inc.;Archived;;;Vendor Contract;2019 Jan WGM/Ballot;;;;;;12/07/2018 08:00
1454;Add Clinical Notes to FHIR (ONC/Grant Project);Board of Directors Work Group;;None;Brett Marquard (WaveOne Associates), Eric Haas (Health eData);Archived;;;Vendor Contract;2019 Sept WGM/Ballot;;;ONC Project Wiki Page: http://wiki.hl7.org/index.php?title=ONC_Grant_Project_Page;;;01/08/2018 08:00
1435;Harmonization of expression languages;Clinical Decision Support Work Group;;Clinical;CDS WG Co-Chairs;3-Year Plan Item;;;- Other -;2021 Sept WGM/Ballot;;;;;;02/08/2018 08:00
1437;Collaborative CDA Template Review Process Pilot;CDA Management Group;Financial Management Work Group, Patient Care Work Group, Pharmacy Work Group, Structured Documents Work Group;None;Lisa Nelson, Brett Marquard;Active Project (Resources assigned to pjt);;27/09/2018;Investigative Project (PSS-Lite);2019 Jan WGM/Ballot;;Collaborative C-CDA Template Review;A confluence page has been created to track progress for this pilot project. PC has created a page for the Clinical Status value set review/request. That space is referenced by the confluence page for the overall pilot. A wiki page has also been created on the SDWG wiki that points to the confluence page.;N/A;White Paper;24/08/2018 08:00
1472;FHIR IG Review & Healthcare Directory FHIR Track for Virtual Connectathon (ONC/Grant Project);Board of Directors Work Group;;None;Dragon Bashyam (Drajer LLC);Archived;;;Vendor Contract;2018 Sept WGM/Ballot;;;ONC Project Wiki Page: http://wiki.hl7.org/index.php?title=ONC_Grant_Project_Page;;;07/09/2018 08:00
1470;Reaffirm Health Level Seven Arden Syntax for Medical Logic Systems, Version 2.10;Arden Syntax Work Group;;Infrastructure;Arden Syntax CoChairs;Archived;05/11/2018;26/11/2018;Ballot - Normative (no STU);2020 May WGM/Ballot;Reaffirmation of a standard;;;N/A;Arden Syntax;13/09/2018 08:00
1449;Reaffirm HL7 Version 3 Standard: XML Implementation Technology Specification - V3 Structures for Wire Format Compatible Release 1 Data Types, Release 1;Implementable Technology Specifications Work Group;;Infrastructure;ITS CoChairs;Archived;06/11/2018;26/11/2018;Ballot - Normative (no STU);2019 Sept WGM/Ballot;Reaffirmation of a standard;;;;;13/09/2018 08:00
1446;Reaffirm HL7 EHR Child Health Functional Profile, Release 1;Electronic Health Records Work Group;;Administrative;EHR CoChairs;Archived;01/02/2019;18/02/2019;Ballot - Normative (no STU);2019 Sept WGM/Ballot;Reaffirmation of a standard;;;;;13/09/2018 08:00
1445;Reaffirm HL7 EHR Behavioral Health Functional Profile, Release 1;Electronic Health Records Work Group;;Administrative;EHR CoChairs;Archived;01/02/2019;18/02/2019;Ballot - Normative (no STU);2019 Sept WGM/Ballot;Reaffirmation of a standard;;;;;13/09/2018 08:00
1447;Reaffirm HL7 EHR Clinical Research Functional Profile, Release 1;Electronic Health Records Work Group;;Administrative;EHR CoChairs;Archived;01/02/2019;18/02/2019;Ballot - Normative (no STU);2020 May WGM/Ballot;Reaffirmation of a standard;;;;;13/09/2018 08:00
1461;Withdraw Health Informatics - Identification of Medicinal Products - Data Elements and Structures for Unique Identification and Exchange of Regulated Information, Release 1;Pharmacy Work Group;;Clinical;Pharmacy CoChairs;Archived;20/10/2018;16/11/2018;Ballot - Withdraw;2019 May WGM/Ballot;Withdraw Current Standard;;;;;13/09/2018 08:00
1463;Withdraw Health Informatics - Identification of Medicinal Products - Data Elements and Structures for Unique Identification of Units of Measurements, Release 1;Pharmacy Work Group;;Clinical;Pharmacy CoChairs;Archived;20/10/2018;16/11/2018;Ballot - Withdraw;2019 May WGM/Ballot;Withdraw Current Standard;;;;;13/09/2018 08:00
1441;"Reaffirm HL7 Version 3 Standard: Context-Aware Retrieval Application (Infobutton); Knowledge Request, Release 2 (revision of ANSI/HL7 V3 INFOB, R1-2010)";Clinical Decision Support Work Group;;Clinical;CDS CoChairs;Archived;19/10/2018;16/11/2018;Ballot - Normative (no STU);2019 Sept WGM/Ballot;Reaffirmation of a standard;;;;V3 Documents-Clinical (e.g. CDA);13/09/2018 08:00
1457;Reaffirm  HL7 Version 3 Standard: Scheduling, Release 2;Patient Administration Work Group;;Administrative;PA CoChairs;Archived;25/10/2018;16/11/2018;Ballot - Normative (no STU);2020 May WGM/Ballot;Reaffirmation of a standard;;;;;13/09/2018 08:00
1458;Withdraw Health Informatics - Identification of Medicinal Products - Data Elements and Structures for Unique Identification and Exchange of Regulated Information  on Pharmaceutical Dose Forms, Units of Presentation and Routes of Administration, Release 1;Pharmacy Work Group;;Clinical;Pharmacy CoChairs;Archived;20/10/2019;16/11/2018;Ballot - Withdraw;2019 May WGM/Ballot;;;;;;13/09/2018 08:00
1465;Reaffirm HL7 Healthcare Privacy and Security Classification System, Release 1;Security Work Group;;Infrastructure;Security CoChairs;Archived;06/11/2018;26/11/2018;Ballot - Normative (no STU);2019 Sept WGM/Ballot;Reaffirmation of a standard;HCS;;No;V3 Documents-Administrative (e.g. SPL);13/09/2018 08:00
1438;Reaffirm HL7 Service-Aware Interoperability Framework: Canonical Definition Specification, Release 2;Architectural Review Work Group;;None;ARB CoChairs;Archived;;16/11/2018;Ballot - Normative (no STU);2020 Jan WGM/Ballot;Reaffirmation of a standard;;;;;13/09/2018 08:00
1439;Reaffirm HL7 Version 3 Standard: Regulated Studies - Annotated ECG, Release 1;Biomedical Research and Regulation Work Group;;Clinical;BRR CoChairs;Archived;16/03/2019;07/06/2019;Ballot - Normative (no STU);2020 May WGM/Ballot;Reaffirmation of a standard;;;;;13/09/2018 08:00
1448;Reaffirm HL7 Version 3 Standard: XML Implementation Technology Specification - Wire Format Compatible Release 1 Data Types, Release 1;Implementable Technology Specifications Work Group;;Infrastructure;ITS CoChairs;Archived;06/11/2018;26/11/2018;Ballot - Normative (no STU);2019 Sept WGM/Ballot;Reaffirmation of a standard;;;;;13/09/2018 08:00
1456;Reaffirm  HL7 Version 3 Standard: Personnel Management, Release 1;Patient Administration Work Group;;Administrative;PA CoChairs;Archived;25/10/2018;16/11/2018;Ballot - Normative (no STU);2019 May WGM/Ballot;Reaffirmation of a standard;;;;;13/09/2018 08:00
1440;Reaffirm HL7 Version 3 IG: Data Segmentation for Privacy (DS4P), Release 1;Security Work Group;Community-Based Care and Privacy (CBCP) Work Group;Clinical;CBCP CoChairs;Archived;09/11/2018;26/11/2018;Ballot - Normative (no STU);2019 May WGM/Ballot;Reaffirmation of a standard;;;;;13/09/2018 08:00
1442;Reaffirm HL7 Version 3 IG: Context-Aware Knowledge Retrieval Application (Infobutton), Release 4;Clinical Decision Support Work Group;;Clinical;CDS CoChairs;Archived;19/10/2018;16/11/2018;Ballot - Normative (no STU);2019 Sept WGM/Ballot;Reaffirmation of a standard;;;;V3 Messages-Clinical;13/09/2018 08:00
1466;Reaffirm HL7 Version 3 Standard: Security and Privacy Ontology, Release 1;Security Work Group;;Infrastructure;Security CoChairs;Archived;06/11/2018;26/11/2018;Ballot - Normative (no STU);2019 May WGM/Ballot;Reaffirmation of a standard;;;No;V3 Documents-Administrative (e.g. SPL);13/09/2018 08:00
1444;Reaffirm HL7 Version 3 Standard: Clinical Statement Pattern, Release 1;Orders and Observations Work Group;;Administrative;OO CoChairs;Archived;05/03/2019;07/06/2019;Ballot - Normative (no STU);2019 Sept WGM/Ballot;Reaffirmation of a standard;;;;;13/09/2018 08:00
1469;"Reaffirm HL7 Version 3 Standard: Pharmacy; Medication CMET, Release 1";Pharmacy Work Group;;Clinical;Pharmacy CoChairs;Archived;20/10/2018;16/11/2018;Ballot - Normative (no STU);2019 Sept WGM/Ballot;;;;;;13/09/2018 08:00
1443;Reaffirm HL7 Version 3 Standard: Pharmacy CMETs, Release 1;Pharmacy Work Group;;Administrative;OO CoChairs;Archived;12/11/2018;26/11/2018;Ballot - Normative (no STU);2019 May WGM/Ballot;Reaffirmation of a standard;;https://gforge.hl7.org/svn/pharmacysig/Mmaterial/Normative/CMETs ;No;V3 Messages-Clinical;13/09/2018 08:00
1462;Withdraw Health Informatics - Identification of Medicinal Products - Data Elements and Structures for Unique Identification and Exchange of   Regulated Information on Substances, Release 1;Pharmacy Work Group;;Clinical;Pharmacy CoChairs;Archived;20/10/2018;16/11/2018;Ballot - Withdraw;2019 May WGM/Ballot;Withdraw Current Standard;;;;;13/09/2018 08:00
1471;Withdraw:  Health Informatics - Identification of Medicinal Products - Data Elements and Structures for Unique Identification and Exchange of Regulated Pharmaceutical Product Information, Release 1;Pharmacy Work Group;;Clinical;Pharmacy CoChairs;Archived;20/10/2018;16/11/2018;Ballot - Withdraw;2019 May WGM/Ballot;Withdraw Current Standard;;;;;13/09/2018 08:00
1467;Withdraw HL7 Version 3 Standard: hData Record Format, Release 1 (PSS in Confluence);Services Oriented Architecture Work Group;;Infrastructure;SOA CoChairs;Archived;28/11/2018;03/12/2018;Ballot - Withdraw;2019 May WGM/Ballot;Withdraw Current Standard;;;;;13/09/2018 08:00
1459;"Reaffirm HL7 Version 3 Standard: Pharmacy; Medication Dispense and Supply Event, Release 2";Pharmacy Work Group;;Clinical;Pharmacy CoChairs;Archived;20/10/2018;16/11/2018;Ballot - Normative (no STU);2019 May WGM/Ballot;Reaffirmation of a standard;;;;;13/09/2018 08:00
1460;"Reaffirm HL7 Version 3 Standard: Pharmacy; Medication Order, Release 2";Pharmacy Work Group;;Clinical;Pharmacy CoChairs;Archived;20/10/2018;16/11/2018;Ballot - Normative (no STU);2019 May WGM/Ballot;Reaffirmation of a standard;;;;;13/09/2018 08:00
1455;"Reaffirm HL7 Version 3 Standard: Patient Administration; Patient Registry, Release 1";Patient Administration Work Group;;Administrative;PA CoChairs;Archived;25/10/2018;16/11/2018;Ballot - Normative (no STU);2020 May WGM/Ballot;Reaffirmation of a standard;;;;;13/09/2018 08:00
1468;Reaffirm HL7 Version 3 Standard: Identification Service (IS), Release 1;Services Oriented Architecture Work Group;;Infrastructure;SOA CoChairs;Archived;06/11/2018;26/11/2018;Ballot - Normative (no STU);2019 May WGM/Ballot;Reaffirmation of a standard;;https://confluence.hl7.org/display/SOA/Services+Oriented+Architecture;;;13/09/2018 08:00
1450;"Reaffirm HL7 Version 3 Standard: Laboratory; Result, Release 1";Orders and Observations Work Group;;Administrative;OO CoChairs;Archived;05/03/2019;01/04/2019;Ballot - Normative (no STU);2025 Jan WGM/Ballot;Reaffirmation of a standard;;;;;13/09/2018 08:00
1464;"Reaffirm HL7 Version 3 Standard: Privacy, Access and Security Services; Security Labeling Service, Release 1";Security Work Group;;Infrastructure;Security CoChairs;Archived;06/11/2018;26/11/2018;Ballot - Normative (no STU);2019 Sept WGM/Ballot;Reaffirmation of a standard;;;No;;13/09/2018 08:00
