Number;Name;Sponsor(s);Co-Sponsor(s);Steering Division;Project Facilitator;Status;SD Approval Date;TSC Approval Date;Type;Project End Date;Project Intent;Common Names / Keywords / Aliases;Project Document Repository;External Vocabularies;Products;Start Date
1104;Structured Data Capture (SDC) FHIR Profile;FHIR Infrastructure Work Group;Clinical Genomics Work Group, Clinical Interoperability Council Work Group, Healthcare Standards Integration, Patient Care Work Group, Vocabulary Work Group;Infrastructure;Ed Hammond;Archived;23/05/2014;28/07/2014;Ballot - STU to Normative;2019 May WGM/Ballot;IG;;"http://wiki.siframework.org/Structured+Data+Capture+IG+Development
FHIR's SVN repository";;;13/05/2014 08:00
1101;Services Directory Rel 2;Patient Administration Work Group;;Administrative;PA WG Co-Chairs;Archived;;;;2017 May WGM/Ballot;;;;;;13/05/2014 08:00
1100;PA/PHER Harmonization of DMIM content;Patient Administration Work Group;;Administrative;PA WG Co-Chairs;Archived;;;;2017 May WGM/Ballot;;;;;;13/05/2014 08:00
1105;PCWG Develop FHIR resources and profiles for the Next STU release.;Patient Care Work Group;;Clinical;Stephen Chu, David Hay;Active Project (Resources assigned to pjt);04/05/2014;15/08/2014;- Other -;2022 Sept WGM/Ballot;Supplement to a Current Standard;;"Resource content will be maintained in http://gforge.hl7.org/svn/fhir/trunk/source. Additional project tracking and supporting project documents will be kept here:

http://wiki.hl7.org/index.php?title=Referral_and_Transition/Transfer_of_Care";;;14/05/2014 08:00
1107;Develop imaging-related FHIR resources for the second DSTU release.;Imaging Integration Work Group;;Administrative;Harry Solomon;Archived;28/07/2014;04/08/2014;- Other -;2015 May WGM/Ballot;Supplement to a Current Standard;;"Resource content will be maintained in http://gforge.hl7.org/svn/fhir/trunk/source. Additional project tracking and supporting project documents will be kept here:

http://wiki.hl7.org/index.php?title=Imaging_Integration_WG ";;;14/05/2014 08:00
1106;HL7 Comments on DICOM Supplement 155;Imaging Integration Work Group;;Administrative;Helmut Koenig, Harry Solomon;Archived;23/05/2014;02/06/2014;Ballot - Comment;2015 May WGM/Ballot;Externally developed IG is to be Adopted, Externally developed IG is to be Endorsed;;Primary project document repository is the DICOM FTP server. Links to, or copies of, project documents will be provided on the IIWG Wiki page.;;- Non Product Project -;14/05/2014 08:00
1110;Develop FHIR resources for Clinical Genomics;Clinical Genomics Work Group;;Clinical;Mollie Ullman-Cullere, Amnon Shabo, Scott Bolte, Gil Alterovitz;Archived;27/06/2014;04/08/2014;- Other -;2015 Sept WGM/Ballot;Supplement to a Current Standard;;Main HL7 website Clinical Genomics document repository;;;14/05/2014 08:00
1111;Essential Information for Children with Special Health Care Needs;Patient Care Work Group;Emergency Care Work Group, Patient Care Work Group;Clinical;Russell Leftwich, Michael Padula, Pele Yu;Active Project (Resources assigned to pjt);18/06/2014;27/06/2014;Ballot - STU to Normative;2024 May WGM/Ballot;IG;;;;V3 Documents-Clinical (e.g. CDA);14/05/2014 08:00
1108;Clinical Quality Expression Language;Clinical Decision Support Work Group;Clinical Quality Information Work Group, Implementable Technology Specifications Work Group;Clinical;Bryn Rhodes;Archived;23/05/2014;28/07/2014;Ballot - STU to Normative;2023 Jan WGM/Ballot;Create New Standard;;http://wiki.hl7.org/index.php?title=Clinical_Quality_Language;;- New Product Definition -;14/05/2014 08:00
1109;Decision Support Service IG, DSTU Updates;Clinical Decision Support Work Group;Services Oriented Architecture Work Group;Administrative;Kensaku Kawamoto;Archived;21/07/2014;;Ballot - STU to Normative;2016 Jan WGM/Ballot;Supplement to a Current Standard, IG;;http://wiki.hl7.org/index.php?title=Clinical_Decision_Support_Workgroup;;V3 Services-Web Services (OMG);14/05/2014 08:00
880;HL7 Website Enhancements - Release 13;Publishing, Electronic Services and Tools Work Group;;Organizational Support;Electronic Services Work Group CoChairs;Archived;;;- Other -;2014 Sept WGM/Ballot;;;;;;15/05/2014 08:00
1076;Re-Affirmation V3 Lab Results;Orders and Observations Work Group;;Administrative;Hans Buitendijk;Archived;23/05/2014;;Ballot - Normative (no STU);2015 Jan WGM/Ballot;Reaffirmation of a standard;;;;V3 Documents-Clinical (e.g. CDA);16/05/2014 08:00
1112;HL7 CDA IG for Ambulatory Healthcare Provider Reporting to Birth Defect Registries;Public Health Work Group;Structured Documents Work Group;Clinical;Laura Rappleye;STU - Test Period/Accepting Comments;23/05/2016;19/07/2016;Ballot - STU to Normative;2024 Jan WGM/Ballot;IG;;"https://confluence.hl7.org/display/PHWG/Public+Health+Registries+Reporting

Project wiki: http://wiki.hl7.org/index.php?title=Birth_defect";N/A;V3 Documents-Clinical (e.g. CDA);19/05/2014 08:00
1113;OO FHIR Lab Result Profile;Orders and Observations Work Group;Public Health Work Group;Administrative;Eric Haas;Archived;23/05/2014;14/07/2014;Ballot - STU to Normative;2019 Jan WGM/Ballot;Create New Standard;;gForge/fhir;;FHIR Extensions;21/05/2014 08:00
1114;Common Product Model (CPM) Release 2 Normative and Structured Product Labeling (SPL) Release 6 Normative.;Orders and Observations Work Group;Biomedical Research and Regulation Work Group;Administrative;Myron Finseth;Archived;23/05/2014;09/06/2014;Ballot - Normative (no STU);2015 Sept WGM/Ballot;Revise Current Standard;;HL7 Wiki / SPL Working Group Wiki.;;"V3 Documents-Knowledge; V3 Messages-Administrative";27/05/2014 08:00
1115;OO FHIR DSTU Monitoring and Maintenance;Orders and Observations Work Group;;Administrative;Hans Buitendijk;Multiple Ballot Levels-See Ballot Cycle Info;28/07/2014;04/08/2014;Ballot - STU to Normative;2025 May WGM/Ballot;Revise Current Standard;;gForge/fhir;;;27/05/2014 08:00
1117;Arden Syntax IG Release 2;Arden Syntax Work Group;;Infrastructure;Robert Jenders;Archived;21/07/2014;28/07/2014;Ballot - Informative;2019 May WGM/Ballot;IG;;http://wiki.hl7.org/index.php?title=Arden_Syntax_Work_Group;;Arden Syntax;28/05/2014 08:00
1119;Develop Immunization-related FHIR resources for DSTU 2 (PHER);Public Health Work Group;;Clinical;Joginder Madra;Archived;24/06/2014;04/08/2014;- Other -;2015 May WGM/Ballot;Supplement to a Current Standard;;TBD;;;30/05/2014 08:00
1086;Allergy and Intolerance Terminology;Patient Care Work Group;Vocabulary Work Group;Clinical;Elaine Ayres and Rob Hausam;Archived;;;Ballot - STU;2015 May WGM/Ballot;;;;;;02/06/2014 08:00
1121;Healthcare and Community Services Provider Directory (Known as Services Directory (ServD) in the Object Management Group (OMG);Patient Administration Work Group;Services Oriented Architecture Work Group;Administrative;Brian Postlethwaite;Archived;21/07/2014;28/07/2014;Ballot - Normative (no STU);2016 Sept WGM/Ballot;Revise Current Standard;;http://wiki.hl7.org/index.php?title=PA_ServD;;V3 Services-Web Services (OMG);25/06/2014 08:00
1120;Balloting of BRIDG model v4.0;Biomedical Research and Regulation Work Group;;Clinical;Jean-Henri Duteau;Archived;30/07/2014;11/08/2014;Ballot - Informative;2017 Sept WGM/Ballot;Revise Current Standard;;Currently stored at bridgmodel.org but the WG is having ongoing discussion about what documents would be stored there (most likely, model-specific documents) and what would be stored on the BRIDG GForge pages (most likely, project reconciliation spreadsheets).;;- New Product Definition -;25/06/2014 08:00
1123;FHIR 2nd DSTU Ballot;FHIR Management Group;Modeling and Methodology Work Group;None;Grahame Grieve;Archived;30/07/2014;11/08/2014;Ballot - STU to Normative;2015 Sept WGM/Ballot;Revise Current Standard;;http://gforge.hl7.org/svn/fhir/trunk;;;25/06/2014 08:00
1122;C-CDA on FHIR;Structured Documents Work Group;;Infrastructure;Austin Kreisler, Grahame Grieve;STU - Test Period/Accepting Comments;24/10/2014;10/11/2014;Ballot - STU to Normative;2022 Sept WGM/Ballot;Supplement to a Current Standard, IG;;"FHIR artifacts:
http://gforge.hl7.org/svn/fhir/trunk

Project related materials:
http://gforge.hl7.org/svn/strucdoc/trunk/FHIR";;;25/06/2014 08:00
1124;FHIR C-CDA profile Informative Ballot;FHIR Management Group;Structured Documents Work Group;None;Grahame Grieve;Archived;;;Ballot - Informative;2015 May WGM/Ballot;IG;;http://gforge.hl7.org/svn/fhir/trunk;;;25/06/2014 08:00
1125;Harmonization of Health Quality Information Models - FHIR;Clinical Quality Information Work Group;Clinical Information Modeling Initiative Work Group, Clinical Decision Support Work Group;Clinical;Bryn Rhodes;STU - Test Period/Accepting Comments;06/02/2017;21/12/2017;Ballot - STU to Normative;2022 May WGM/Ballot;Revise Current Standard;QI Core, QUICK, FHIR Quality, QUICK Logical View;"http://www.hl7.org/implement/standards/fhir/qicore/qicore.html
http://hl7docs.appspot.com/quick/index.html";N/A;;03/07/2014 08:00
1126;Definition of Record-Entry Lifecycle-Event Metadata (using FHIR);Electronic Health Records Work Group;;Administrative;Gary Dickinson;Archived;11/08/2014;18/08/2014;- Other -;2019 May WGM/Ballot;Supplement to a Current Standard;;http://wiki.hl7.org/index.php?title=EHR_Interoperability_WG;;;07/07/2014 08:00
1127;Harmonization of Health Quality Information Models - Logical Model;Clinical Quality Information Work Group;Clinical Decision Support Work Group;Clinical;Aziz Boxwala, Chris Millet;Archived;11/07/2014;08/09/2014;Ballot - STU to Normative;2016 Sept WGM/Ballot;Create New Standard;;http://wiki.hl7.org/index.php?title=Harmonization_of_Health_Quality_Information_model;;V3 Documents-Clinical (e.g. CDA);11/07/2014 08:00
1128;Patient Care FHIR resource review;Patient Care Work Group;;Clinical;Jay Lyle, Michelle Miller;Active Project (Resources assigned to pjt);30/07/2014;18/08/2014;- Other -;2022 Jan WGM/Ballot;Revise Current Standard;;Project assets will be kept at https://confluence.hl7.org/display/PC/Patient+Care ;;;11/07/2014 08:00
1130;HL7 Patient-friendly language for Security and Privacy for Consent Directives;Community-Based Care and Privacy (CBCP) Work Group;Security Work Group;Clinical;Suzanne Gonzales-Webb;Archived;09/06/2014;08/09/2014;Ballot - STU to Normative;2022 Sept WGM/Ballot;Create New Standard;;http://wiki.hl7.org/index.php?title=Community-Based_Collaborative_Care ;;;14/07/2014 08:00
1131;Positioning Security Risk Analysis standard within HL7;Project Services Work Group;Publishing Work Group, Security Work Group, Structured Documents Work Group;Organizational Support;Rick Haddorff, Freida Hall;Archived;30/06/2014;28/07/2014;- Other -;2015 Sept WGM/Ballot;New/Modified HL7 Policy/Procedure/Process;;Project Services GForge Documents: http://gforge.hl7.org/gf/project/psc/docman/Positioning%20Security%20Risk%20Analysis%20standard%20within%20HL7/;;- New/Modified HL7 Policy/Procedure/Process -;14/07/2014 08:00
1129;Update existing Pharmacy FHIR resources and develop new FHIR profiles for Pharmacy;Pharmacy Work Group;;Clinical;Melva Peters;Archived;30/07/2014;15/08/2015;- Other -;2016 Jan WGM/Ballot;Supplement to a Current Standard;;"Resource content will be maintained in http://gforge.hl7.org/svn/fhir/trunk/source. Additional project tracking and supporting project documents will be kept here:
http://wiki.hl7.org/index.php?title=Pharmacy_-_FIHR ";;FHIR Resources;14/07/2014 08:00
1134;EHR-S FM/FP Profile Designer Tool (for PHR-S FM);Electronic Health Records Work Group;PEST Work Group;Administrative;William Goossen;Archived;15/09/2014;06/10/2014;Vendor Contract;2018 May WGM/Ballot;N/A (Project not directly related to an HL7 Standard);;"http://wiki.hl7.org/index.php?title=EHRs_FM_Profiling_Tool 
HL7 gforge. http://gforge.hl7.org/gf/project/ehrsfm_profile/docman/ ";;;15/07/2014 08:00
1133;HL7 V2.8.2;Orders and Observations Work Group;Infrastructure and Messaging Work Group, Publishing Work Group, Vocabulary Work Group;Administrative;Hans Buitendijk;Archived;11/07/2014;28/07/2014;Ballot - Normative (no STU);2015 Sept WGM/Ballot;Revise Current Standard;;http://wiki.hl7.org/index.php?title=Category:OO_Change_Requests under V2.8.2 proposals.;;V2 Messages-Clinical;15/07/2014 08:00
1132;July 2014 Post Harmonization;Board of Directors Work Group;No Selection;None;Ted Klein;Archived;25/06/2014;25/06/2014;Vendor Contract;2014 Sept WGM/Ballot;Revise Current Standard;;;;V3 Foundation-RIM;18/07/2014 08:00
1136;Template Metadata Load to HingX;Publishing, Electronic Services and Tools Work Group;;Organizational Support;Andy Stechishin;Archived;;;- Other -;2015 Sept WGM/Ballot;New/Modified HL7 Policy/Procedure/Process;;http://wiki.hl7.org/index.php?title=Templates_HingX_Load_Project;;- Non Product Project -;23/07/2014 08:00
1137;3YP Placeholder;Arden Syntax Work Group;;Infrastructure;Arden Syntax WG Co-Chairs;Archived;;;- Other -;2015 Jan WGM/Ballot;;;;;;15/08/2014 08:00
1138;CDC Developmental Screening;Patient Care Work Group;;Clinical;Child Health WG Co-Chairs;Archived;;;- Other -;2015 Sept WGM/Ballot;;;;;;21/08/2014 08:00
1140;Measure Report using FHIR;Clinical Quality Information Work Group;No Selection;Clinical;Chris Millet;Archived;20/10/2014;10/11/2014;Ballot - Comment;2016 Jan WGM/Ballot;Supplement to a Current Standard;;http://wiki.hl7.org/index.php?title=MeasureReportProfile ;;;12/09/2014 08:00
1139;Pharmacy Universal CDA Templates;Pharmacy Work Group;Structured Documents Work Group;Clinical;Melva Peters;STU - Test Period/Accepting Comments;15/09/2014;06/10/2014;Ballot - STU to Normative;2023 Sept WGM/Ballot;Supplement to a Current Standard;;"HL7 Wiki http://wiki.hl7.org/index.php?title=Pharmacy_Universal_Templates_Project
HL7 Document Repository http://www.hl7.org/Special/committees/medication/docs.cfm 
Template library (to be determined)";;V3 Documents-Clinical (e.g. CDA);12/09/2014 08:00
1143;Data Access Framework (DAF) FHIR Profile;Infrastructure and Messaging Work Group;Structured Documents Work Group;Infrastructure;Jonathan Coleman;Archived;02/11/2014;19/12/2014;Ballot - STU to Normative;2019 May WGM/Ballot;IG;;"http://wiki.siframework.org/Data+Access+Framework+Homepage 
FHIR's SVN repository";;FHIR Extensions;03/10/2014 08:00
1142;CQL-based HQMF IG;Clinical Quality Information Work Group;Clinical Decision Support Work Group;Clinical;Bryn Rhodes;STU - Test Period/Accepting Comments;06/10/2016;24/10/2016;Ballot - STU to Normative;2025 May WGM/Ballot;Revise Current Standard;CQL-based HQMF ;http://wiki.hl7.org/index.php?title=Harmonization_of_Health_Quality_Information_model;No;V3 Documents-Knowledge;03/10/2014 08:00
1144;Bipolar and Generalized Anxiety Disorder Domain Model;Clinical Interoperability Council Work Group;;Clinical;Maryam Younes;Archived;19/01/2015;24/03/2015;Ballot - Informative;2021 May WGM/Ballot;Create New Standard, Revise Current Standard;;http://www.hl7.org/Special/committees/cic/index.cfm;;Domain Analysis Model (DAM);07/10/2014 08:00
1145;Knowledge Artifact Authoring Environment Requirements Definition Project;Clinical Decision Support Work Group;Clinical Quality Information Work Group;Administrative;Claude Nanjo;Archived;;;Ballot - Comment;2018 Jan WGM/Ballot;N/A (Project not directly related to an HL7 Standard);N/A;http://hssp.wikispaces.com/editor;;- Non Product Project -;08/10/2014 08:00
1146;Unified Conformance and Constraint Modeling (previously known as Refinement, Constraint and Localization, Release 3);Conformance Work Group;Infrastructure and Messaging Work Group, Modeling and Methodology Work Group, Vocabulary Work Group;Infrastructure;Frank Oemig;On Hold;;;Ballot - Informative;2023 Jan WGM/Ballot;Revise Current Standard, Supplement to a Current Standard;;"HL7 GForge: http://gforge.hl7.org/gf/project/hdf/
Wiki page: http://wiki.hl7.org/index.php?title=Unified_Conformance_Guidance";;"V2 Messages-Infrastructure; V3 Documents-Clinical (e.g. CDA); V3 Foundation-RIM; V3 Foundation-Vocab Domains & Value Sets";09/10/2014 08:00
1150;HL7 Clinical Document Architecture, Release 2.1;Structured Documents Work Group;Clinical Statement Work Group, Implementable Technology Specifications Work Group, Modeling and Methodology Work Group, Templates Work Group, Vocabulary Work Group;Infrastructure;Calvin Beebe / Diana Behling;Archived;24/10/2014;10/11/2014;Ballot - Normative (no STU);2021 Jan WGM/Ballot;Revise Current Standard;;;;V3 Documents-Clinical (e.g. CDA);13/10/2014 08:00
1149;IG for CDA R2 - Lvl 3 Personal Healthcare Monitoring Reports, R1;Structured Documents Work Group;Devices Work Group;Administrative;Barry Reinhold;Archived;26/05/2014;03/03/2015;Ballot - Normative (no STU);2017 Jan WGM/Ballot;IG;;N/A;;V3 Documents-Clinical (e.g. CDA);13/10/2014 08:00
1147;ISO Identification of Medicinal Products (IDMP) Technical Specifications and EU/EMA Requirements for SPL Release 7;Biomedical Research and Regulation Work Group;Orders and Observations Work Group;Clinical;Vada Perkins, Paolo Alcini;Archived;;03/03/2014;ISO JIC Ballot Project;2017 May WGM/Ballot;Revise Current Standard, IG, Externally developed IG is to be Adopted;ISO IDMP, IDMP, EU Requirements for HL7 CPM/SPL , SPL R7;HL7 Publishing Document Repository;;"V3 Documents-Administrative (e.g. SPL); V3 Foundation-RIM";13/10/2014 08:00
1158;"Reaffirm GELLO; A Common Expression Language, Release 2";Clinical Decision Support Work Group;;Administrative;Andrew McIntyre;Archived;10/12/2015;08/02/2016;Ballot - Normative (no STU);2016 Sept WGM/Ballot;Reaffirmation of a standard;GELLO R2 ;http://wiki.hl7.org/index.php?title=Clinical_Decision_Support_Workgroup#Projects;No;V3 Rules-GELLO;16/10/2014 08:00
1151;EMS Patient Care Report Release Two;Clinical Interoperability Council Work Group;;Clinical;Mitra Rocca;Archived;13/09/2014;10/11/2014;Ballot - Normative (no STU);2016 May WGM/Ballot;Revise Current Standard;;http://wiki.hl7.org/index.php?title=EMS_Projects;;V3 Documents-Clinical (e.g. CDA);20/10/2014 08:00
1152;Re-Ballot Release 2 of 'Core principles of V3 Models' - a limited scope update;Modeling and Methodology Work Group;;Infrastructure;George Beeler;Archived;31/10/2014;17/11/2014;Ballot - Normative (no STU);2018 Sept WGM/Ballot;Revise Current Standard;;SVN - input/infrastructure/coreprinciples/v3modelcoreprinciples.mif;;V3 Foundation-RIM;23/10/2014 08:00
1154;EHR System Functional Model-Security and Privacy Joint Vocabulary Alignment;Electronic Health Records Work Group;Community-Based Care and Privacy (CBCP) Work Group, Services Oriented Architecture Work Group;Administrative;Steve Hufnagel;Archived;15/09/2014;10/11/2014;- Other -;2015 Sept WGM/Ballot;;;EHR Interoperability Wiki: http://wiki.hl7.org/index.php?title=EHR_Interoperability_WG;;;31/10/2014 08:00
1155;HL7 Attachment Supplement Specification: Request and Response IG Release 2;Payer/Provider Info Exchange Work Group;;Clinical;Craig Gabron and Durwin Day;Archived;27/02/2015;24/03/2015;Ballot - Informative;2017 Jan WGM/Ballot;IG;Supplemental Attachment Guide, Attachment Supplemental Guide ;http://www.hl7.org/special/Committees/claims/docs.cfm;No;- New/Modified HL7 Policy/Procedure/Process -;31/10/2014 08:00
1073;HL7 Endorsement of 'HL7 EHR-System for a Pharmacist/Pharmacy Electronic Health Record IG for Community Practice;Pharmacy Work Group;Electronic Health Records Work Group;Clinical;Scott Robertson;Archived;02/12/2014;08/12/2014;Ballot - Informative;2016 Jan WGM/Ballot;Externally developed IG is to be Endorsed;;http://gforge.hl7.org/svn/pharmacysig/pharmacysig/Material/Balloting/eRx Functional Profile ;;Functional Profile;03/11/2014 08:00
1159;Reaffirmation of HL7 EHR System Long Term Care Functional Profile, Release 1 - US Realm;Electronic Health Records Work Group;;Administrative;Pat Van Dyke;Archived;19/01/2015;10/08/2015;Ballot - Normative (no STU);2016 Jan WGM/Ballot;Reaffirmation of a standard;;;No;;06/11/2014 08:00
1160;November 2014 Post Harmonization;Board of Directors Work Group;No Selection;None;Ted Klein;Archived;;;Vendor Contract;2015 Jan WGM/Ballot;Revise Current Standard;;;;V3 Foundation-RIM;21/11/2014 08:00
1161;SHARE Project - Phase 1 (Affiliate Submissions);Board of Directors Work Group;;None;David Hamill;Archived;;;- Other -;2015 Jan WGM/Ballot;N/A (Project not directly related to an HL7 Standard);;GForge under 'SHARE Project';;- New/Modified HL7 Policy/Procedure/Process -;12/12/2014 08:00
1085;Care Plan Clinical Models;Patient Care Work Group;;None;Stephen Chu and Laura Heerman Langford;Archived;;;Ballot - STU;2023 Sept WGM/Ballot;;;;;;26/01/2015 08:00
1163;Derived Domain Profile to the HL7 EHR Child Health Functional Profile focused on Developmental Screening;Patient Care Work Group;Electronic Health Records Work Group;Clinical;Pele Yu, Michael Padula;Archived;27/02/2015;09/03/2015;Ballot - Informative;2017 Sept WGM/Ballot;Supplement to a Current Standard;;http://wiki.hl7.org/index.php?title=Developmental_Screening_Derived_Domain_Profile;;;30/01/2015 08:00
1162;Value Set Maintenance and Stewardship;Structured Documents Work Group;Vocabulary Work Group;Infrastructure;Brett Marquard;Active Project (Resources assigned to pjt);19/01/2015;16/02/2015;- Other -;2025 Sept WGM/Ballot;New/Modified HL7 Policy/Procedure/Process;;N/A;;- Non Product Project -;30/01/2015 08:00
1173;March 2015 Post Harmonization;Board of Directors Work Group;No Selection;None;Ted Klein;Archived;;;Vendor Contract;2015 May WGM/Ballot;Revise Current Standard;;;;V3 Foundation-RIM;02/02/2015 08:00
1165;Clinical Genomics - Genetic Variation (Fully LOINC-Qualified Genetic Variation Model);Clinical Genomics Work Group;;Clinical;Mollie Ullman-Cullere;Archived;27/02/2015;17/03/2015;Ballot - Informative;2017 May WGM/Ballot;Revise Current Standard;;"Project documents and requirements will be uploaded to the main HL7 website within the clinical genomics document section: <a href=""http://www.hl7.org/Special/committees/clingenomics/docs.cfm?wg_id=7&amp;wg_docs_subfolder_name=docs"">http://www.hl7.org/Special/committees/clingenomics/docs.cfm?wg_id=7&amp;wg_docs_subfolder_name=docs";;V2 Messages-Clinical;02/02/2015 08:00
1167;Pharmacist EHR-System Functional Profile Release 1.0;Electronic Health Records Work Group;Pharmacy Work Group;Administrative;"Shelly Spiro; Scott Robertson; Sue Thompson";Archived;20/02/2015;03/03/2015;Ballot - Normative (no STU);2018 May WGM/Ballot;Create New Standard;;In development on the HL7 wiki. ;;Electronic Health Record;02/02/2015 08:00
1166;Showcase - Nursing Electronic Health Record Applications, Devices and Apps Communicating Patient Data Electronically using HL7 standards & IHE profiles;Patient Care Work Group;Clinical Interoperability Council Work Group, Electronic Health Records Work Group;Clinical;Laura Heermann LangfordDr William Goossen, Pat van Dyke, Patrick Weber;Archived;19/01/2015;04/05/2015;- Other -;2022 Sept WGM/Ballot;N/A (Project not directly related to an HL7 Standard);;http://wiki.hl7.org/index.php?title=HL7_Nurse_Group ;;"FHIR Extensions; FHIR Resources; V3 Documents-Clinical (e.g. CDA); V3 Foundation-Vocab Domains & Value Sets; V3 Messages-Clinical";02/02/2015 08:00
1169;HL7 Value Set Discovery Tool: Vocabulary Mining Tool;Terminology Authority Work Group;PEST Work Group, Vocabulary Work Group;None;"Heather Grain; Sandra Stuart";Archived;;;- Other -;2017 Jan WGM/Ballot;N/A (Project not directly related to an HL7 Standard);;http://www.hl7.org/special/committees/termauth/docs.cfm;;- Non Product Project -;06/02/2015 08:00
1171;University/College Internernship Process Development;Project Services Work Group;Education Work Group, Technical Steering Committee;Organizational Support;Tom Maroon;Archived;23/02/2015;09/03/2015;- Other -;2017 Sept WGM/Ballot;N/A (Project not directly related to an HL7 Standard);;the university intership component projects are a part.;N/A;- Non Product Project -;06/02/2015 08:00
1172;Clinical Genomics Domain Analysis Model;Clinical Genomics Work Group;;Clinical;Amnon Shabo (Shvo) and Mollie Ullman-Cullere;Archived;;;;2016 Sept WGM/Ballot;Create New Standard;CG DAM/DIM;http://www.hl7.org/Special/committees/clingenomics/docs.cfm;N/A;Domain Analysis Model (DAM);06/02/2015 08:00
1168;Add FHIR Appendix to HL7 Attachment Specification: Supplement to Consolidated CDA Templated Guide, Release 1;Payer/Provider Info Exchange Work Group;;Clinical;Craig Gabron;Archived;27/02/2015;24/03/2015;- Other -;2015 May WGM/Ballot;Supplement to a Current Standard;Supplemental Attachment Guide, Attachment Supplemental Guide ;http://www.hl7.org/special/Committees/claims/products.cfm;No;- New/Modified HL7 Policy/Procedure/Process -;06/02/2015 08:00
1170;HL7 Value Set Discovery Tool: Vocabulary Register (extend the Vocabulary Mining Tool);Terminology Authority Work Group;PEST Work Group, Vocabulary Work Group;None;"Heather Grain; Sandra Stuart";Archived;;;- Other -;2016 Sept WGM/Ballot;New/Modified HL7 Policy/Procedure/Process;;http://www.hl7.org/special/committees/termauth/docs.cfm;;- New/Modified HL7 Policy/Procedure/Process -;06/02/2015 08:00
1174;Behavioral Health Domain Analysis Model,  Release 2.0;Community-Based Care and Privacy (CBCP) Work Group;Clinical Interoperability Council Work Group, Patient Care Work Group;Clinical;Ken Salyards (SAMHSA);Archived;12/05/2015;14/05/2015;Ballot - Informative;2017 May WGM/Ballot;Revise Current Standard;BH DAM ;"SVN: <a href=""http://gforge.hl7.org/gf/project/cbcc/scmsvn/?action=browse&amp;path=%2Ftrunk%2FBH_DAM%2F"">http://gforge.hl7.org/gf/project/cbcc/scmsvn/?action=browse&amp;path=%2Ftrunk%2FBH_DAM%2F
Releases: <a href=""http://gforge.hl7.org/gf/project/cbcc/frs/?action=FrsReleaseBrowse&amp;frs_package_id=212"">http://gforge.hl7.org/gf/project/cbcc/frs/?action=FrsReleaseBrowse&amp;frs_package_id=212";Yes;Domain Analysis Model (DAM);17/02/2015 08:00
