Id;Label;Name;Sponsors;Co_sponsors;Steering Division;Facilitator;Status;SD Approval Date;TSC Approval Date;Type;Project End Date;Project Intent;Aliases;Project Document Repository;External Vocabularies;Products;Start Date
1010;1010;Ordering Service Interface Specification Project;Orders and Observations Work Group;Clinical Decision Support Work Group, Imaging Integration Work Group, Pharmacy Work Group, Services Oriented Architecture Work Group;Administrative;Claude Nanjo;STU - Preparing Ballot;21/12/2016;24/06/2013;Ballot - Informative;2025 Jan WGM/Ballot;Create New Standard;Order Service, Order Catalog, Order Management;http://hssp.wikispaces.com/orders;;"FHIR Profile; FHIR Resources";30/10/2020 08:00
1668;1668;Reaffirmation:  HL7 Version 3 Standard: Transmission Infrastructure, Release 2;Infrastructure and Messaging Work Group;;None;InM Co-Chairs;Active Project (Resources assigned to pjt);;24/01/2022;;2022 Sept WGM/Ballot;;;"ANSI Standards approaching expiration confluence page: 
https://confluence.hl7.org/display/HL7/ANSI+Standards+approaching+expiration";;;12/11/2020 08:00
1672;1672;Withdraw HL7 Version 3 Standard: Clinical Statement CMETs, Release 1;Orders and Observations Work Group;;None;OO Co-Chairs;Active Project (Resources assigned to pjt);24/03/2021;16/07/2021;;2022 Jan WGM/Ballot;;;"PSS: https://confluence.hl7.org/display/OO/Withdrawal+for+V3+Clinical+Statement+CMETs

ANSI Standards approaching expiration confluence page: 
https://confluence.hl7.org/display/HL7/ANSI+Standards+approaching+expiration";;;12/11/2020 08:00
1681;1681;US Realm Program Manager (COVID/US Realm ONC/Grant Contract project);Board of Directors Work Group;;None;Gay Dolin;Active Project (Resources assigned to pjt);;;Vendor Contract;2023 Jan WGM/Ballot;;;https://confluence.hl7.org/display/PMO/ONC+Grant+Project+Page;;;16/11/2020 08:00
1680;1680;Extract Clinical Notes (COVID/PH ONC/Grant funded project);Board of Directors Work Group;;None;Boston Children's Hospital;Active Project (Resources assigned to pjt);;;Vendor Contract;2023 Jan WGM/Ballot;;;https://confluence.hl7.org/display/PMO/ONC+Grant+Project+Page;;;24/11/2020 08:00
1704;1704;FHIR IG: Migrate from Structured Product Labeling V3 to a FHIR-based submission (PSS in Confluence);Biomedical Research and Regulation Work Group;;Clinical;Jean Duteau;Active Project (Resources assigned to pjt);19/04/2021;26/04/2021;Ballot - STU to Normative;2022 May WGM/Ballot;IG;;"https://confluence.hl7.org/display/BRR/FHIR+IG+Project+Space%3A+Migrate+from+SPL+V3+to+a+FHIR-based+submission

PSS: https://confluence.hl7.org/display/BRR/FHIR+Implementation+Guide%3A+Migrate+from+Structured+Product+Labeling+V3+to+a+FHIR-based+submission";Yes;FHIR IG;24/11/2020 08:00
1682;1682;US Realm Steering Committee Senior Advisor (COVID/US Realm ONC/Grant Contract project);Board of Directors Work Group;;None;Brett Marquard;Active Project (Resources assigned to pjt);;;Vendor Contract;2021 Sept WGM/Ballot;;;https://confluence.hl7.org/display/PMO/ONC+Grant+Project+Page;;;01/12/2020 00:00
1695;1695;Developing, Advancing and Harmonizing Social Determinants of Health (SDOH) Standards (COVID/Public Health ONC/Grant project);Board of Directors Work Group;;None;Evelyn Gallego;Active Project (Resources assigned to pjt);;;Vendor Contract;2023 May WGM/Ballot;;;https://confluence.hl7.org/display/PMO/ONC+Grant+Project+Page;;;01/12/2020 00:00
1589;1589;FHIR Survey (ONC/Grant funded project);Board of Directors Work Group;;None;Mark Iantorno;Active Project (Resources assigned to pjt);;;Vendor Contract;2021 Sept WGM/Ballot;;;https://confluence.hl7.org/display/PMO/ONC+Grant+Project+Page;;;07/12/2020 08:00
1690;1690;National Healthcare Directory;Patient Administration Work Group;Financial Management Work Group, Payer/Provider Info Exchange Work Group;Administrative;Robert Dieterle;Active Project (Resources assigned to pjt);01/04/2021;09/04/2021;Ballot - STU to Normative;2025 Sept WGM/Ballot;IG;Validated Healthcare Directory, Payer Directory, Provider Directory, Endpoint Directory;"To be determined

PSS In Confluence: https://confluence.hl7.org/display/PA/National+Healthcare+Directory";Yes;"FHIR IG; FHIR Profile";09/12/2020 08:00
1679;1679;Clinical Domains (COVID/PH ONC/Grant funded project);Board of Directors Work Group;;None;Logica Health;Active Project (Resources assigned to pjt);;;Vendor Contract;2025 Jan WGM/Ballot;;;https://confluence.hl7.org/display/PMO/ONC+Grant+Project+Page;;;10/12/2020 08:00
1683;1683;Subject Matter Experts (SMEs): Landscape Assessment/Gap Analysis: Security & Privacy and Public Health Standards (COVID/PH ONC/Grant funded project);Board of Directors Work Group;;None;David Pyke, Craig Newman;Active Project (Resources assigned to pjt);;;Vendor Contract;2023 Jan WGM/Ballot;;;https://confluence.hl7.org/display/PMO/ONC+Grant+Project+Page;;;21/12/2020 08:00
1700;1700;IHE SDC/eCC on FHIR;Orders and Observations Work Group;;Administrative;Alexander Goel (CAP);Active Project (Resources assigned to pjt);;;Ballot - STU to Normative;2025 Jan WGM/Ballot;IG;"IHE SDC on FHIR
eCC on FHIR";PSS: https://confluence.hl7.org/pages/viewpage.action?pageId=97476801;;FHIR IG;25/01/2021 08:00
1686;1686;HL7 FHIR IG: Cancer Electronic Pathology Reporting (Jira PSS-1688);Orders and Observations Work Group;Clinical Interoperability Council Work Group, Public Health Work Group, Structured Documents Work Group;Administrative;Zabrina Gonzaga;STU - Reconcile;15/03/2021;23/03/2021;Ballot - STU;2022 Sept WGM/Ballot;IG;Cancer pathology reports, ePathology Reporting, CA ePath Reporting, ePath on FHIR;"PSS:  https://jira.hl7.org/browse/PSS-1688

https://github.com/HL7/fhir-cancer-reporting-ig";;FHIR IG;26/01/2021 08:00
1687;1687;Integrated Trial Matching for Cancer Patients and Providers (Jira PSS-1686);Biomedical Research and Regulation Work Group;;Clinical;Caroline Potteiger;Active Project (Resources assigned to pjt);14/04/2021;16/04/2021;Ballot - STU;2022 Sept WGM/Ballot;;Trial Matching ;PSS: https://jira.hl7.org/browse/PSS-1686?src=confmacro;;;02/02/2021 08:00
1689;1689;FHIR at Scale (FAST): Scalable Registration, Authentication, and Authorization for FHIR Ecosystem Participants;Security Work Group;;Infrastructure;Luis Maas and Brett Stringham;STU - Reconcile;09/04/2021;16/04/2021;Ballot - STU to Normative;2025 May WGM/Ballot;IG;Keywords: UDAP, FAST, Security, Authentication, Authorization, Registration ;"For additional information: <a href=""https://oncprojectracking.healthit.gov/wiki/download/attachments/118849815/FAST-PS-Security-v3draft-SEP8-2020.docx?version=1&amp;modificationDate=1608220408000&amp;api=v2"">https://oncprojectracking.healthit.gov/wiki/download/attachments/118849815/FAST-PS-Security-v3draft-SEP8-2020.docx?version=1&amp;modificationDate=1608220408000&amp;api=v2";;FHIR IG;02/02/2021 08:00
1691;1691;PACIO FHIR Profile - Re-assessment Timepoint (Jira PSS-1712);Community-Based Care and Privacy (CBCP) Work Group;Patient Care Work Group;Clinical;Chris Pugliese;Active Project (Resources assigned to pjt);16/04/2021;26/04/2021;Ballot - STU;2022 Jan WGM/Ballot;;Re-assessment Timepoint;PSS in Jira: https://jira.hl7.org/browse/PSS-1712;;;09/02/2021 08:00
1692;1692;Radiation Dose Summary for Diagnostic Procedures on FHIR (Jira PSS-1716);Imaging Integration Work Group;Clinical Quality Information Work Group, Pharmacy Work Group;Administrative;Abderrazek Boufahja;STU - Preparing Ballot;02/03/2021;09/04/2021;Ballot - STU;2022 Jan WGM/Ballot;Create New Standard;"Dose Summary on FHIR
Dose Report";"PSS: https://jira.hl7.org/browse/PSS-1716

https://confluence.hl7.org/display/IMIN/Radiation+Dose+Summary+for+Diagnostic+Procedures+on+FHIR";No;FHIR IG;23/02/2021 08:00
1693;1693;CDA IG Web Publishing (Jira PSS-1684);CDA Management Group;Structured Documents Work Group, Vocabulary Work Group;None;Lisa R. Nelson;Active Project (Resources assigned to pjt);26/04/2021;26/04/2021;Ballot - Informative;2022 Jan WGM/Ballot;Create New Standard;CDA IG Publisher;"PSS: https://jira.hl7.org/browse/PSS-1684

https://confluence.hl7.org/display/CDA/CDA+IG+Publishing";Don't Know;- New/Modified HL7 Policy/Procedure/Process -;24/02/2021 08:00
1513;1513;"FHIR Risk Adjustment (Da Vinci Project; PSS in Confluence)";Clinical Quality Information Work Group;No Selection;Clinical;Yan Heras, Linda Michaelsen, Viet Nguyen;Active Project (Resources assigned to pjt);19/05/2021;;Ballot - STU to Normative;2025 Jan WGM/Ballot;IG;Da Vinci, Chronic Illness Documentation, Risk Adjustment ;"2021 April PSS: https://confluence.hl7.org/display/CQIWC/FHIR+Risk+Adjustment+PSS

HTTP: //confluence.hl7.org/pages/viewpage.action?pageId=39158184
https://confluence.hl7.org/display/FM/PSS+for+Chronic+Illness+Documentation+for+Risk+Adjustment";Yes;FHIR IG;12/03/2021 08:00
1699;1699;Care Team Domain Analysis Model Version 2 (PSS in Confluence);Learning Health Systems Work Group;Clinical Information Modeling Initiative Work Group, Patient Care Work Group, Public Health Work Group;Clinical;Russell Leftwich;Active Project (Resources assigned to pjt);20/08/2021;20/08/2021;Ballot - Informative;2022 Sept WGM/Ballot;Revise Current Standard;Learning Health System, LHS, Care Team, Care Team Roster, Care Coordination;"https://confluence.hl7.org/display/LHS/Learning+Health+Systems

PSS: https://confluence.hl7.org/display/LHS/Care+Team+Domain+Analysis+Model+Version+2+PSS";Don't Know;Domain Analysis Model (DAM);16/03/2021 08:00
1694;1694;SMART Health Cards: Vaccination & Testing IG (Jira PSS-1783);Public Health Work Group;;Clinical;Max Masnick;STU - Reconcile;19/04/2021;26/05/2021;Ballot - Informative;2022 Jan WGM/Ballot;IG;vaccination credentials, vaccination yellow card, vaccine yellow card;"PSS: https://confluence.hl7.org/x/Kqs7Bg

Project Proposal: https://jira.hl7.org/browse/PSS-1783";Yes;FHIR IG;22/03/2021 08:00
1697;1697;CARIN IG for Digital Insurance Card;Payer/Provider Info Exchange Work Group;Financial Management Work Group;Administrative;Mark Roberts, Adam Culbertson, Cille Kissel;Active Project (Resources assigned to pjt);19/04/2021;03/05/2021;Ballot - STU;2022 Jan WGM/Ballot;Supplement to a Current Standard;CARIN, Digital Membership ID;;;"FHIR Extensions; FHIR IG; FHIR Resources";30/03/2021 08:00
1703;1703;Transfer Value Sets to HL7 Analysis (ONC/Grant project);Board of Directors Work Group;;None;Jean Duteau;Active Project (Resources assigned to pjt);;;Vendor Contract;2021 Sept WGM/Ballot;;;"On the Confluence ONC Grant Project Page:
https://confluence.hl7.org/display/PMO/ONC+Grant+Project+Page";;;12/04/2021 08:00
1702;1702;BR and R FHIR Resource Maintenance;Biomedical Research and Regulation Work Group;Clinical Quality Information Work Group, Orders and Observations Work Group, Pharmacy Work Group;Clinical;BRR CoChairs;Active Project (Resources assigned to pjt);;;Ballot - STU;2021 Sept WGM/Ballot;Revise Current Standard, Supplement to a Current Standard;Medication Definition, Research Resources, BRR Resources;;;FHIR Profile;13/04/2021 08:00
1720;1720;Clinical Registry Extraction and Data Submission (CREDS) IG;Clinical Interoperability Council Work Group;Public Health Work Group;;Dave Pyke, Russ Leftwich;Active Project (Resources assigned to pjt);;;Ballot - STU to Normative;2023 May WGM/Ballot;IG;CREDS;"TBA

PSS:  https://confluence.hl7.org/display/CIC/Clinical+Registry+Extraction+and+Data+Submission+%28CREDS%29+IG";;FHIR IG;25/05/2021 08:00
1707;1707;DICOM SR to FHIR Resource Mapping IG;Imaging Integration Work Group;;Administrative;Jonathan Whitby, Chris Lindop;Active Project (Resources assigned to pjt);;17/12/2021;Ballot - STU to Normative;2022 Sept WGM/Ballot;IG;DICOM SR / IHE AIR;"PSS: https://confluence.hl7.org/display/IMIN/DICOM+SR+to+FHIR+Resource+Mapping+PSS

https://github.com/HL7/dicom-sr";No;FHIR IG;26/05/2021 08:00
1715;1715;Reaffirmation: HL7 Version V3 GELLO IG: Clinical Decision Support, Model Definition Language for GELLO, Release 1;Clinical Decision Support Work Group;;;CDS WG Co-Chairs;Active Project (Resources assigned to pjt);;31/01/2022;Ballot - Normative (no STU);2022 Sept WGM/Ballot;;;;;;02/06/2021 08:00
1712;1712;Reaffirmation: HL7 Version 3 Domain Analysis Model: Diet and Nutrition Orders, Release 2;Orders and Observations Work Group;;;OO Co-Chairs;Active Project (Resources assigned to pjt);;21/02/2022;Ballot - Normative (no STU);2022 Sept WGM/Ballot;;;;;;02/06/2021 08:00
1717;1717;Improving identity assurance and patient match quality through interoperable Digital Identity and Patient Matching capabilities;Patient Administration Work Group;;;Meena Jambulingam, Carmen Smiley, Julie Maas;Active Project (Resources assigned to pjt);25/06/2021;25/06/2021;Ballot - STU to Normative;2025 May WGM/Ballot;IG;FAST Identity / Patient matching / Digital Identity / record linkage / Patient Identifiers / unique patient identification / identity resolution;"PSS: https://confluence.hl7.org/display/PA/Patient+Matching+PSS

https://confluence.hl7.org/display/PA/Interoperable+Digital+Identity+and+Patient+Matching+Capabilities";No;FHIR IG;09/06/2021 08:00
1718;1718;POLST CDA IG (COVID/Public Health ONC/Grant project);Board of Directors Work Group;;None;Kit Cooper (Lantana);Active Project (Resources assigned to pjt);;24/09/2021;Vendor Contract;2022 Sept WGM/Ballot;;;"On the Confluence ONC Grant Project Page:
https://confluence.hl7.org/display/PMO/ONC+Grant+Project+Page";;;23/06/2021 08:00
1725;1725;US Realm Content Administrator (aka Content Curator) (COVID/US Realm ONC Contract);Board of Directors Work Group;;None;Marc Duteau;Active Project (Resources assigned to pjt);;;Vendor Contract;2023 Jan WGM/Ballot;;;https://confluence.hl7.org/display/PMO/ONC+Grant+Project+Page;;;19/07/2021 08:00
1721;1721;Project to increase consistency & quality of FHIR-authored IGs (Jira PSS-1807);FHIR Infrastructure Work Group;CDA Management Group, FHIR Management Group, Infrastructure and Messaging Work Group, Modeling and Methodology Work Group;;Lloyd McKenzie;Active Project (Resources assigned to pjt);20/08/2021;20/08/2021;- Other -;2023 May WGM/Ballot;;FHIR-based IG Governance;"PSS: https://jira.hl7.org/browse/PSS-1807?src=confmacro

https://github.com/fhir/ig-guidance";No;;19/07/2021 08:00
1732;1732;C-CDA to and from FHIR Structural Mapping (Jira PSS-1811);Cross-Group Projects Work Group;Structured Documents Work Group;;Natalee Agassi;Active Project (Resources assigned to pjt);;28/09/2021;Ballot - STU to Normative;2022 May WGM/Ballot;;C-CDA to and from US Core Mapping;"TO BE ESTABLISHED

PSS: https://jira.hl7.org/browse/PSS-1811";Yes;;12/08/2021 08:00
1277;1277;FHIR for Device Data Reporting;Devices Work Group;Healthcare Standards Integration, Mobile Health Work Group, Orders and Observations Work Group;Clinical;Todd Cooper;STU - Reconcile;16/08/2016;22/08/2016;Ballot - STU;2022 Jan WGM/Ballot;Revise Current Standard, White Paper (Balloted Informative), IG;DoF, Devices on FHIR, medical device, healthcare device, personal health device;Project information and documents will be posted at the project wiki page ( http://wiki.hl7.org/index.php?title=DoF_Project_-_Device_Data_Reporting) and on GForge (linked from the wiki page).;Yes;"FHIR Profile; FHIR Resources";13/08/2021 08:00
1728;1728;Problem Oriented Health Record (POHR);Electronic Health Records Work Group;Patient Empowerment Work Group;;Gary Dickinson;Active Project (Resources assigned to pjt);;18/10/2021;Ballot - Normative (no STU);2023 Jan WGM/Ballot;White Paper (Non-Balloted WG Approved Only);Problems 'Problem List';"PSS: https://confluence.hl7.org/display/EHR/Problem+Oriented+Health+Record+%28POHR%29+2

https://confluence.hl7.org/pages/viewpage.action?pageId=120752354";;FHIR IG;20/08/2021 08:00
1674;1674;Withdrawal:  HL7 Version 3 Standard: Patient Administration CMETs, Release 1;Patient Administration Work Group;;None;PA Co-Chairs;Active Project (Resources assigned to pjt);;25/10/2021;Ballot - Normative (no STU);2022 Sept WGM/Ballot;;;"ANSI Standards approaching expiration confluence page: 
https://confluence.hl7.org/display/HL7/ANSI+Standards+approaching+expiration";;;25/08/2021 08:00
1673;1673;"Withdrawal: HL7 Version 3 Standard: Patient Administration; Patient Encounter, Release 1";Patient Administration Work Group;;None;PA Co-Chairs;Active Project (Resources assigned to pjt);;25/10/2021;Ballot - Normative (no STU);2022 Sept WGM/Ballot;;;"ANSI Standards approaching expiration confluence page: 
https://confluence.hl7.org/display/HL7/ANSI+Standards+approaching+expiration";;;25/08/2021 08:00
1675;1675;"Withdrawal: HL7 Version 3 Standard: Registries; Real Time Location Tracking, Release 1";Patient Administration Work Group;;None;PA Co-Chairs;Active Project (Resources assigned to pjt);;25/10/2021;Ballot - Normative (no STU);2022 Sept WGM/Ballot;;;"ANSI Standards approaching expiration confluence page: 
https://confluence.hl7.org/display/HL7/ANSI+Standards+approaching+expiration";;;25/08/2021 08:00
1729;1729;International Patient Summary Advocate (ONC/Grant project);Board of Directors Work Group;;None;John D'Amore (More Informatics);Active Project (Resources assigned to pjt);;;Vendor Contract;2022 Sept WGM/Ballot;;;"On the Confluence ONC Grant Project Page:
https://confluence.hl7.org/display/PMO/ONC+Grant+Project+Page";;;02/09/2021 08:00
1730;1730;US Realm Dashboard Developer (COVID/US Realm ONC Contract);Board of Directors Work Group;;None;Enzenwa Dike;Active Project (Resources assigned to pjt);;;Vendor Contract;2022 Jan WGM/Ballot;;;https://confluence.hl7.org/display/PMO/ONC+Grant+Project+Page;;;03/09/2021 08:00
1731;1731;PACIO Project: Speech, Language, Swallowing, Cognitive Communication, and Hearing (SPLASCH);Patient Care Work Group;Community-Based Care and Privacy (CBCP) Work Group;;Jamila Harley;Active Project (Resources assigned to pjt);;18/10/2021;Ballot - STU to Normative;2023 Jan WGM/Ballot;IG;Speech-language pathology, cognitive skills, health literacy, feeding and swallowing, multi-modal functional communication, speech and voice;"TBD

PSS: https://confluence.hl7.org/pages/viewpage.action?pageId=91991989";Yes;FHIR IG;13/09/2021 08:00
1733;1733;HL7 Unique Mobile Health App Identifier (UMHAI) (Jira PSS-1867);Mobile Health Work Group;Devices Work Group, Orders and Observations Work Group;;Gora Datta;Active Project (Resources assigned to pjt);;19/10/2021;Ballot - STU to Normative;2023 Jan WGM/Ballot;Create New Standard;UHMAI;"PSS: https://jira.hl7.org/browse/PSS-1867

https://confluence.hl7.org/display/MH/Unique+Mobile+Health+Application+Identifier+%28UMHAI%29+Project";;;17/09/2021 08:00
1118;1118;Arden Syntax for Medical Logic Systems v3.0;Arden Syntax Work Group;Clinical Decision Support Work Group;;Robert Jenders;Informative - Preparing for Ballot;05/11/2018;26/11/2018;Ballot - Informative;2024 Sept WGM/Ballot;Revise Current Standard;Arden Syntax for Medical Logic Systems v3.0, Arden Manual, Arden Syntax Manual, Arden Standard, MLM Standard.;"PSS on Confluence: https://confluence.hl7.org/display/ARD/Arden+Syntax+for+Medical+Logic+Systems+v3.0-PSS

https://confluence.hl7.org/display/ARD/Arden+Syntax+v3.0";No;Arden Syntax;20/09/2021 08:00
1736;1736;Longitudinal Maternal & Infant Health Information for Research - FHIR R4 IG (Jira PSS-1832);Public Health Work Group;No Selection;;Zabrina Gonzaga;Active Project (Resources assigned to pjt);;;Ballot - STU;2022 Sept WGM/Ballot;;Maternal Health for Research, Maternal Morbidity and Mortality, SMMM, Severe Maternal Morbidity and Mortality, Pregnancy, Linked Records, Maternal and Infant Records, Record Linkage;PSS:  https://jira.hl7.org/browse/PSS-1832;;;27/09/2021 08:00
1734;1734;Informative standard withdrawal - multiple projects;Technical Steering Committee;;;Melva Peters;Comment - Preparing Ballot;;28/06/2021;Ballot - Withdraw;2022 Sept WGM/Ballot;;;https://confluence.hl7.org/display/TSC/Informative+Withdrawals+2022JAN;;;04/10/2021 08:00
1737;1737;HL7 Medicolegal Death Investigation (MDI) FHIR IG (Jira PSS-1885);Public Health Work Group;;;Diana Wright;Active Project (Resources assigned to pjt);;01/12/2021;Ballot - STU;2022 Sept WGM/Ballot;;MDI, MDI FHIR IG, MDI IG, Medicolegal Death IG;"PSS: https://jira.hl7.org/browse/PSS-1885

https://github.com/HL7/fhir-mdi-ig";Yes;;07/10/2021 08:00
1740;1740;HL7 Systems Engineer;Board of Directors Work Group;;None;Michael Dubendris;Active Project (Resources assigned to pjt);;;Vendor Contract;2022 Sept WGM/Ballot;;;;;;11/10/2021 08:00
1735;1735;Normative withdrawal project placeholder;Technical Steering Committee;;;Melva Peters;Active Project (Resources assigned to pjt);;01/12/2021;Ballot - Withdraw;2023 Jan WGM/Ballot;;;;;;15/10/2021 08:00
1738;1738;Gender Harmony Support (ONC/Grant project);Board of Directors Work Group;;None;Rob McClure (MD Partners, Inc.);Active Project (Resources assigned to pjt);;;Vendor Contract;2022 Jan WGM/Ballot;;;"On the Confluence ONC Grant Project Page:
https://confluence.hl7.org/display/PMO/ONC+Grant+Project+Page";;;18/10/2021 00:00
1741;1741;Logica Sandbox;Board of Directors Work Group;;None;Preston Lee;Active Project (Resources assigned to pjt);;;Vendor Contract;2022 May WGM/Ballot;;;;;;19/10/2021 08:00
1688;1688;Pediatric Care Health IT Functional Profile (PSS in Confluence);Electronic Health Records Work Group;Clinical Interoperability Council Work Group, Patient Care Work Group;Administrative;Pele Yu, MD MS;Informative - Reconcile;22/02/2021;12/03/2021;Ballot - Informative;2022 May WGM/Ballot;Create New Standard, White Paper (Balloted Informative);Pediatric, Child Health, health IT, 21st century cures act;"Confluence PSS: https://confluence.hl7.org/display/EHR/Pediatric+Care+Health+IT+Functional+Profile+-+PSS

Project Page: https://confluence.hl7.org/display/EHR/Pediatric+Care+Health+IT+Functional+Profile+-+Project";;Electronic Health Record;20/10/2021 08:00
1742;1742;At-Home Test Report (Jira PSS-1892);Public Health Work Group;Orders and Observations Work Group;;Matthew Rahn;Active Project (Resources assigned to pjt);;24/01/2022;Ballot - STU to Normative;2023 Jan WGM/Ballot;IG;At-Home Test Result Report;"Will add a Confluence Page once we get WG sponsorship

PSS: https://jira.hl7.org/browse/PSS-1892?src=confmacro";;FHIR IG;11/11/2021 08:00
1743;1743;Consultant Pharmacist Consult Note update (Jira PSS-1884);Pharmacy Work Group;Structured Documents Work Group;;Shelly Spiro;Active Project (Resources assigned to pjt);;03/01/2022;Ballot - Informative;2023 Jan WGM/Ballot;IG;Pharmacist Consult Note;"https://confluence.hl7.org/display/PHAR/Consultant+Pharmacist+Consultation+Note+Update

PSS: https://jira.hl7.org/browse/PSS-1884?src=confmacro";;FHIR IG;06/12/2021 08:00
1745;1745;Radiation Therapy Treatment Data (Jira PSS-1903);Cross-Group Projects Work Group;Patient Care Work Group;;Anthony DiDonato;Active Project (Resources assigned to pjt);;24/01/2022;Ballot - STU to Normative;2023 Jan WGM/Ballot;IG;"Radiation Therapy

Radiation Therapy Treatment Data (RTTD)";"PSS: https://jira.hl7.org/browse/PSS-1903?src=confmacro

Radiation Therapy IG: http://build.fhir.org/ig/HL7/codex-radiation-therapy/branches/master/index.html &amp; Radiation Therapy GitHub Repository: https://github.com/HL7/codex-radiation-therapy/ ";;FHIR IG;09/12/2021 08:00
1746;1746;CHOICE Guideline for the use of a Fetal Resource;Patient Care Work Group;Public Health Work Group;;Mike Padula, Michael Tan;Active Project (Resources assigned to pjt);;;Ballot - Informative;2021 Jan WGM/Ballot;White Paper (Balloted Informative);Fetus model, body site, obstetrics;;;White Paper;15/12/2021 08:00
1744;1744;ICHOM breast cancer patient-centered outcome measure set FHIR IG;Clinical Interoperability Council Work Group;Clinical Information Modeling Initiative Work Group, Clinical Quality Information Work Group;;Mica Carr;Active Project (Resources assigned to pjt);;;Ballot - STU to Normative;2023 Jan WGM/Ballot;IG;;;;FHIR IG;29/12/2021 08:00
1753;1753;5-year expiration approaching: HL7 Version 3 Standard: Transport Specifications - ebXML, Release 1;Implementable Technology Specifications Work Group;;;ITS WG Co-Chairs;Active Project (Resources assigned to pjt);;;Ballot - Normative (no STU);2022 Sept WGM/Ballot;;;;;;13/01/2022 08:00
1751;1751;Withdraw: HL7 Version 3 Standard: Claims and Reimbursement, Release 4;Financial Management Work Group;;;FM WG Co-Chairs;Active Project (Resources assigned to pjt);;;Ballot - Normative (no STU);2022 Sept WGM/Ballot;;;;;;13/01/2022 08:00
1752;1752;"5-year expiration approaching: HL7 Version 3 Standard: Clinical Genomics; Pedigree, Release 1";Clinical Genomics Work Group;;;CG WG Co-Chairs;Active Project (Resources assigned to pjt);;;Ballot - Normative (no STU);2022 Sept WGM/Ballot;;;;;;13/01/2022 08:00
1748;1748;5-year expiration approaching: HL7 Version 2: XML Encoding Rules, Release 2;Implementable Technology Specifications Work Group;;;ITS WG Co-Chairs;Active Project (Resources assigned to pjt);;;Ballot - Normative (no STU);2023 Jan WGM/Ballot;;;;;;13/01/2022 08:00
1750;1750;Withdraw: HL7 Version 3 Standard: Accounting & Billing, Release 2;Financial Management Work Group;;;FM WG Co-Chairs;Active Project (Resources assigned to pjt);;;Ballot - Normative (no STU);2022 Sept WGM/Ballot;;;;;;13/01/2022 08:00
1747;1747;5-year expiration approaching: HL7 Version 3 Standard: Transport Specification - ebXML Using eb MS2.0. Release 1;Implementable Technology Specifications Work Group;;;ITS WG Co-Chairs;Active Project (Resources assigned to pjt);;;Ballot - Normative (no STU);2022 Sept WGM/Ballot;;;;;;13/01/2022 08:00
1749;1749;Reaffirm: HL7 Version 3 Standard: Representation of the Health Quality Measures Format (eMeasure), Release 1;Clinical Quality Information Work Group;;;CQI WG Co-Chairs;Active Project (Resources assigned to pjt);;24/01/2022;Ballot - Normative (no STU);2022 Sept WGM/Ballot;;;PSS: https://confluence.hl7.org/display/CQIWC/Health+Quality+Measure+Format+%28HQMF%29+Reaffirmation+Project;;;13/01/2022 08:00
